title,price,area,property_url,page_number,property_index,scraped_at,posting_date_text,parsed_posting_date,bathrooms,balcony,property_type,furnishing,floor_details,locality,society,status,facing,parking,ownership,transaction,overlooking,data_quality_score,validation_issues,is_valid,amenities,description,builder_name,location_address,specifications
3 BHK Apartment for Sale in Sector 112 Gurgaon,3.85 Cr,2215 sqft,https://www.magicbricks.com/tata-gurgaon-gateway-sector-112-gurgaon-pdpid-4d4235303239353935,1,1,2025-08-11 12:26:08.959107,Posted: Yesterday,2025-08-10 12:00:00.000000,3.0,,3 BHK,Semi-Furnished,10 out of 23,,Tata Gurgaon Gateway,Ready to Move,,,,Resale,,84.2,[],True,,"About Tata Gurgaon GatewayTata Gurgaon Gateway located in Sector 112 , Gurgaon has amazing luxury flats available from Rs. 2.39 Cr - 5.24 Cr.Gurgaon Gateway sets a new benchmark for luxurious living and modern architecture, right from the plush double-heighted lobbies to the timber sun decks and private terraces that grace the apartments. A unique lifestyle awaits the patrons of this enclave, with sprawling balconies that overlook the lush greenery and landscapes. These balconies are seamless extensions of the living and dining areas. This means that residents can experience the outdoors from the comfort of their home. Every aspect of this expansive development has been designed with attention to the finest of details. For instance, the 3 bed residences have been innovatively designed to enable three open sides in the apartment to increase cross ventilation. So go ahead- live a life of grandeur, the one you were always meant to live.Tata Gurgaon Gateway StatusReady To MoveTowers in Tata Gurgaon Gateway6Positioned at well connected locality Sector 112, Tata Gurgaon Gateway is an aesthetically built project of Gurgaon. The property is a part of an integrated township which spreads over an area of 9 Acre. There are in total 358 units in this project.This world class Tata Gurgaon Gateway has been granted. its commencement certificate. The occupancy certificate also granted. A renowned builder TATA Housing Development Company Ltd. has crafted Tata Gurgaon Gateway with a lot of perfection. You can reach out to this project at Sector 112, Bajghera Road, Near Dwarka Expressway, Gurugram: 122017. 122017 is the area pincode under which this project falls. At Tata Gurgaon Gateway, a quality living is guaranteed by modern amenities and healthy surroundings.Top Amenities in Tata Gurgaon GatewayPower Back UpCafeteria/Food CourtJogging and Strolling TrackOutdoor Tennis CourtsAEROBICS ROOMEvent Space & AmphitheatreKids Play AreaTata Gurgaon Gateway BrochureWant to learn more about the well-planned Tata Gurgaon Gateway project? Download their detailed PDF brochure. You will find the brochure under the link 'Download Brochure', placed at the top right end of the page. You can have access to the brochure of Tata Gurgaon Gateway by providing details such as your name, email address and contact details.Tata Gurgaon Gateway AddressIf you would like to know the complete address for Tata Gurgaon Gateway in Gurgaon, it is Sector 112, Bajghera Road, Near Dwarka Expressway, Gurugram: 122017, 122017",TATA Housing Development Company Ltd.41YearsExperience,"Sector 112,Gurgaon",{}
2 BHK Apartment for Sale in Sector 60 Gurgaon,2.95 Cr,1540 sqft,https://www.magicbricks.com/ireo-skyon-sector-60-gurgaon-pdpid-4d4235303230313733,1,2,2025-08-11 12:26:08.961029,Updated today,2025-08-11 12:00:00.000000,3.0,2.0,2 BHK,Semi-Furnished,2 out of 12,,IREO Skyon,Ready to Move,North - West,2 Covered,Freehold,Resale,Garden/Park,110.5,[],True,,"About IREO SkyonOverviewIREO Skyon located in Sector 60 , Gurgaon has amazing luxury flats available from INR 1.20 Cr to 2.40 Cr.Breathe a new life with IREO Skyon located in the prime neighbourhood of Sector 60, Gurgaon. Developed by IREO, this mega township features 6 brilliantly designed towers sheltering nearby 790 residential units. The units are available with 2, 2+Study, 3 & 4- bedroom configurations. This township is a part of the stunning IREO City spread over 500 acres.About the ProjectThese fully automated smart homes are appointed with air-conditioning units and are impressive with sleek & stylish modular kitchens. Replete with fresh air & natural light, all the well-ventilated residential apartments of IREO Skyon, Sector 60, Gurgaon are worth buying to live a balanced life with your precious family.All the residential apartments of this gorgeous township have been complemented with charming balconies to offer mesmerising views of the surrounding landscapes. The balconies are well-constructed such that, they can be accessed from the living/dining room, master bedroom and a bedroom. So, book a flat now in IREO Skyon, Sector 60, Gurgaon and lead a contentment life with your family.These 3-side open apartments are blessed with good ventilation to keep your spirit lively & cheerful. Decked with modern amenities & facilities like clubhouse, swimming pool, gym and many more other features, this luxurious project is set to offer you an extremely comfortable & peaceful living. The spectacular 3-acre Pitch 'n' Putt Golf Park will surely leave you amazed.Floor Plan of Ireo SkyonFloor plans are a great way to understand how the spaces/rooms connect with each other in a house and help provide a bigger picture to a buyer. The properties in IREO Skyon are available in 3 configurations and 18 varied layouts (or floor plans), with 2BHKs present in 1365, 1375, 1524 and 1535 sq. ft. super area, 3BHKs in 1919, 2022, 2045, 2055, 2058 and 2092 sq. ft. super area, and 4BHKs in 2529, 2768, 2791, 2797, 2800, 2807, 2816 and 2818 sq. ft super area. All these configurations come with 2-4 balconies. IREO Skyon Floor Plan for all these property configurations are made available on this page for your reference.Brochure of Ireo SkyonThe IREO Skyon official Brochure PDF will provide you with comprehensive and detailed information about the project. To view the brochure for IREO Skyon refer to the link ‘Download Brochure’ on the top right side of the page. Fill in the required details like your name, contact number and e-mail ID and you will be able to view the brochure PDF.Address of Ireo SkyonThe postal address of IREO Skyon in GURGAON is ""Golf Course Ext Rd, Sector 60, Gurugram, Haryana - 122001"".HighpointsPlaced conveniently in the principle location, IREO Skyon Sector 60, Gurgaon enjoys good connectivity to several good schools, hospitals, malls and other prime venues. Connectivity to public transport facilities make this locality worthwhile. Furthermore, a proposed metro station situated close by to this society will further enhance the connectivity.IREO Skyon PriceRs. 2. 90 Cr - 3. 90 CrProject TypeResidentialProperty TypesFlatIREO Skyon StatusReady To MoveIREO Skyon Launch Date01 February 2011IREO Skyon Possession Date01 December 2017Towers in IREO Skyon15Located in Sector 60, Gurgaon, the IREO Skyon is a thoughtfully planned one, equipped with all amenities for a comfortable living. It is spread out over a large area of 18 Acre. This project has a total of 790 units.The project offers property options such as Flat which are unparalleled and value for money. The commencement certificate of this well-planned project has been granted. In addition to this, the occupancy certificate granted. The well-known builder Ireo Management Pvt. Ltd. has developed IREO Skyon project. You can reach out to this project at Golf Course Ext Rd, Sector 60, Gurugram, Haryana. The project's pin code is 122102. IREO Skyon lets you enjoy a convenient lifestyle with all contemporary conveniences at your disposal.Top Amenities in IREO SkyonGolf CourseInternet/Wi-Fi ConnectivityIndoor Squash & Badminton CourtsBar/LoungeAEROBICS ROOMGymnasiumSwimming PoolIREO Skyon Floor PlanUnit ConfigurationUnit SizeIREO Skyon 2 BHK Flat1524. 0 Sq. Ft. - 1524. 0 Sq. Ft.To get an idea into the way the house is structured and how the rooms and other spaces interact with each other, view the floor plans of the units. At IREO Skyon, you are offered as many as 1 configuration, available in 1 types of floor plans. There are well-laid out balconies and modern bathrooms with all these configurations. You can view differnt configurations across unit sizes of IREO Skyon on Magicbricks.IREO Skyon BrochureDownload the PDF brochure of IREO Skyon and get the complete details of this beautifully constructed project. You can easily find this brochure under the 'Download Brochure' link which is placed on the top right side of the page. To view the IREO Skyon brochure PDF, fill in your details like name, contact number, and email ID.IREO Skyon AddressIf you would like to know the complete address for IREO Skyon in Gurgaon, it is Golf Course Ext Rd, Sector 60, Gurugram, Haryana, 122102","Ireo Management Pvt. Ltd.21YearsExperienceIreo Campus, Archview Drive, Ireo City, Golf Course Extension Road, Gurgaon-122101","Sector 60,Gurgaon",{}
"3 BHK Apartment for Sale in Nirvana Country, Sector 50 Gurgaon",4.80 Cr,3000 sqft,https://www.magicbricks.com/unitech-the-close-north-nirvana-country-gurgaon-pdpid-4d4235323834363237,1,4,2025-08-11 12:26:08.963524,Updated today,2025-08-11 12:00:00.000000,3.0,3.0,3 BHK,Furnished,Lower Basement out of 19,,Unitech The Close North,Ready to Move,,,,Resale,,89.5,[],True,,"About Unitech The Close NorthUnitech The Close North PriceRs. 3. 75 Cr - 5. 25 CrProject TypeResidentialProperty TypesFlatUnitech The Close North StatusReady To MoveUnitech The Close North Launch Date01 January 2006Unitech The Close North Possession Date01 January 2009Favourably located in Sector 50 in Gurgaon, Unitech The Close North is a meticulously planned project. This project encompasses over 685 units.Flat are the various types of units available, each of which has been created to provide total satisfaction. A renowned builder Unitech limited has crafted Unitech The Close North with a lot of perfection. Planning to invest in this exclusive property? You can visit the property at Sector 50, Gurgaon, Haryana. The pin code of this masterpiece project is 122018. Unitech The Close North spells convenience and comfort at a competitive price.Unitech The Close North Floor PlanUnit ConfigurationUnit SizeUnitech The Close North 2 BHK Flat1997. 0 Sq. Ft. - 1997. 0 Sq. Ft.Unitech The Close North 3 BHK Flat2093. 0 Sq. Ft. - 2491. 0 Sq. Ft.Unitech The Close North 4 BHK Flat2939. 0 Sq. Ft. - 2946. 0 Sq. Ft.To gain an overview of the house structure, it is best to study the floor plans as these will give you a clear picture of the layout. The properties in Unitech The Close North are available in 3 configurations and 6 varied layouts (or floor plans), All these configurations come with bathrooms and balconies. All the various configurations of Unitech The Close North are available on Magicbricks for your reference.Unitech The Close North BrochureWant to learn more about the well-planned Unitech The Close North project? Download their detailed PDF brochure. The brochure can be viewed at the top right side of the page under the link 'Download Brochure'. To download the Unitech The Close North brochure, you will have to provide the basic details such as your name, contact details and email address.Unitech The Close North AddressSector 50, Gurgaon, Haryana, 122018, is the postal address of Unitech The Close North in Gurgaon.",Unitech limited,"Sector 50,Gurgaon",{}
3 BHK Builder Floor for Sale in Sector 70A Gurgaon,2.60 Cr,1750 sqft,https://www.magicbricks.com/bptp-green-oaks-sector-70a-gurgaon-pdpid-4d4235333236323433,1,5,2025-08-11 12:26:08.965661,Updated today,2025-08-11 12:00:00.000000,3.0,2.0,3 BHK,Semi-Furnished,4 out of 4,,BPTP Green Oaks,,North - East,,Freehold,Resale,Garden/Park,100.0,[],True,,"About BPTP Green OaksBPTP Green Oaks Sector 70a Gurgaon offers astounding sun-confronting sees, extensive lodging, green environmental elements, luxurious offices, and considerably more under one undertaking. This improvement project means to give open to living in a lovely and wonderful area. The venture is deliberately positioned in the delightful area of Sector 70A, Gurgaon. BPTP Green Oaks plots sector 70a Gurgaon is a smart and eco-accommodating municipality with finished nurseries and more than 2000 trees previously planted. BPTP Green Oaks Plots is a residential plots in Gurgaon Project.Green Oaks offers you the choice of building your dream home in your very own private oasis. A life you always aspire for you and your family with all state of the art amenities and facilities. A well connected location in Sector 70-A that provides excellent connectivity, with all major facilities like Schools, Hospitals , Southern Peripheral road and NH 8.Project TypeResidentialProperty TypesBuilder FloorBPTP Green Oaks StatusUnder ConstructionBPTP Green Oaks Launch Date01 October 2021BPTP Green Oaks Possession Date01 June 2025BPTP Green Oaks is conveniently situated in the Sector 70A, Gurgaon and is a project that is well planned. The property is a part of an integrated township which spreads over an area of 1 Acre. The property comprises of 279 units which are enclosed within a peaceful environment.Builder Floor are the various types of units available, each of which has been created to provide total satisfaction. The beautiful BPTP Green Oaks's commencement certificate has not been granted. The occupancy certificate also not granted. BPTP Green Oaks project is an offering from the well-established developer BPTP Ltd. . Sector 70A, Gurgaon is the full address of the site. Its pincode is 122101. BPTP Green Oaks lets you enjoy a convenient lifestyle with all contemporary conveniences at your disposal.Top Amenities in BPTP Green OaksEarth quake resistantLiftMeditation AreaKids Play Pool With Water SlidesConcierge ServicesParkPower Back UpBPTP Green Oaks Floor PlanUnit ConfigurationUnit SizeBPTP Green Oaks 3 BHK Builder Floor1800. 0 Sq. Ft. - 1800. 0 Sq. Ft.Floor plans tell you exactly how big or small the rooms or spaces in a house are, and so are the perfect way to get an understanding of the house layoutThe units in BPTP Green Oaks come in a choice of 1 types of floor plans as per the 1 configurations. Spacious balconies and well-fitted bathrooms ensure a ventilated environment in these configurations. To get an idea of the space covered, layout and room sizes, browsing through the floor plan would help. Magicbricks presents to you a range of layouts across different units of BPTP Green Oaks.BPTP Green Oaks BrochureYou can get all details of BPTP Green Oaks by downloading their PDF brochure here. You will find the brochure under the link 'Download Brochure', placed at the top right end of the page. Just enter the details like name, email address and contact details and you can download the brochure of BPTP Green Oaks.BPTP Green Oaks AddressBPTP Green Oaks is situated in the prime city of Gurgaon. The full address is Sector 70A, Gurgaon, 122101.","BPTP Ltd.22YearsExperienceBPTP Capital City, 6th Floor, Plot No. 2B, Sector-94, Gautam Buddh Nagar, Noida, UP - 201301","Sector 70A,Gurgaon",{}
"Studio Apartment for Sale in Sector 37D, Delhi Gurgaon Expressway Gurgaon",8 Lac,325 sqft,https://www.magicbricks.com/ramprastha-the-edge-towers-sector-37d-gurgaon-pdpid-4d4235303130333531,1,7,2025-08-11 12:26:08.969196,Updated today,2025-08-11 12:00:00.000000,,,Studio,Unfurnished,3 out of 10,,Ramprastha The Edge Towers,Ready to Move,,1 Covered,,Resale,,84.2,[],True,,"About Ramprastha The Edge TowersRamprastha The Edge Towers developed by Ramprastha Group is located in Sector 37D, Gurgaon. The project consists of 1280 units distributed among 15 magnificent towers. The flats are offered with 2, 3 and 4 BHK configurations and are spread arcos 1310 – 2390 sqft. Ramprastha The Edge Towers flat prices range from Rs. 53.0 Lacs to Rs. 1.0 Cr. For more details, navigate through Ramprastha The Edge Towers photos & floor plans.About the projectStill under-construction, Ramprastha Edge Towers possession date is scheduled for April 2018. Surround by stunning landscapes and decked with an array of high-end amenities, this society invite you to live an urban lifestyle with your family. Ramprastha Edge Towers resale prices are also well-quoted as per the current market price trends.The 2BHK flats of this project measure 1310 sqft whereas the 4-bedroom apartments cover an area of 2390 sqft. However, the 3 BHK units are offered in multiple sizes of 1675 sqft and 1990 sqft. Fresh breeze and sparkling sunrays adorn these apartments all along the day. Branded fittings, premium flooring, wonderful interiors and charming balconies are some of the special features of these flats.A luxurious clubhouse, refreshing swimming pool and a spectacular golf course are some of the praiseworthy features of this lavish residence. Kids play area, gym, rain water harvesting, intercom facility and maintenance staff are also provided. With so much to offer, this residential haven is an ideal place to live a happy life with your family.HighpointsA perfect location with excellent public transport connectivity and all the social infrastructures like schools, hospitals, etc., at an arms distance is the prime advantage of this development.  Well-situated beside 150 meters Dwarka- Gurgaon Expressway, Sector 37D, Gurgaon – Ramprastha Edge Towers reviews are supremely positive, thus making it a profitable investment opportunity. So, pay a visit today and book a flatRamprastha The Edge Towers StatusReady To MoveRamprastha The Edge Towers Launch Date01 January 2009Ramprastha The Edge Towers Possession Date01 December 2016Towers in Ramprastha The Edge Towers15Situated at a prime location of Sector 37D, Delhi Gurgaon Expressway, Ramprastha The Edge Towers is a meticulously designed project of Gurgaon. The property is a part of an integrated township which spreads over an area of 450 Acre. The property comprises of 1272 units which are enclosed within a peaceful environment.The beautiful Ramprastha The Edge Towers's commencement certificate has not been granted. The occupancy certificate of the project not granted. A renowned builder Ramprastha Group has crafted Ramprastha The Edge Towers with a lot of perfection. Dwarka Expy, Sector 37D, Gurugram, Haryana is the official address of this project. This project comes under the pincode of 122001. Ramprastha The Edge Towers lets you enjoy a convenient lifestyle with all contemporary conveniences at your disposal.Top Amenities in Ramprastha The Edge TowersVaastu CompliantIndoor Squash & Badminton CourtsOutdoor Tennis CourtsMaintenance StaffIntercom FacilityVisitor ParkingSecurityRamprastha The Edge Towers BrochureWish to know more about Ramprastha The Edge Towers? Download this comprehensive brochure to get the full details. This brochure is available on the top right side of the page under the link 'Download Brochure'. To download the Ramprastha The Edge Towers brochure, you will have to provide the basic details such as your name, contact details and email address.Ramprastha The Edge Towers AddressDwarka Expy, Sector 37D, Gurugram, Haryana, 122001, is the complete address of Ramprastha The Edge Towers","Ramprastha Group65YearsExperience114, Sec-44, Gurgaon, Haryana-122002","Sector 37D,Gurgaon",{}
3 BHK Apartment for Sale in Sector 83 Gurgaon,1.94 Cr,1850 sqft,https://www.magicbricks.com/ss-cendana-sector-83-gurgaon-pdpid-4d4235343136383231,1,8,2025-08-11 12:26:08.971613,Updated today,2025-08-11 12:00:00.000000,3.0,3.0,3 BHK,Semi-Furnished,26 out of 33,,SS Cendana,,Read more,,Freehold,Resale,Garden/Park,100.0,[],True,,"About SS Cendana""Situated at a prime location of Sector 83, SS Cendana is a meticulously designed project of Gurgaon. The prices of this meticulously planned SS Cendana project lie in the range of Rs. 1. 75 Cr - 3. 50 Cr. This project has its expanse over an area of 12 Acre. There are in total 1300 units in this project.A professionally conceptualised Residential property, this state-of-the art project is visually appealing. The units are all Under Construction. Designed to cater to the needs of different individuals, the property offers different unit types as Flat. The property units are spacious and range in size from 2 BHK Flat (1450. 0 Sq. Ft. - 1450. 0 Sq. Ft. ), 4 BHK Flat (2500. 0 Sq. Ft. - 2500. 0 Sq. Ft. ), 3 BHK Flat (1450. 0 Sq. Ft. - 1850. 0 Sq. Ft. ). The well-planned site has 10 towers, and each of them have their own plus points. 01 September 2023 is the project's launch date. The estimated possession date of the project is 01 August 2029.The grand SS Cendana project's commencement certificate has been granted. The occupancy certificate also not granted. SS Cendana has been built by reputed real estate developer SS Group. SS Cendana ensures the availability of first class premium amenities such as Lift, Club House, Swimming Pool, Gymnasium, Reserved Parking, Visitor Parking, Jogging and Strolling Track, Coffee Lounge & Restaurants. The site's exact address is Sector 83, Gurugram, Haryana 122004. The project falls under the pincode 122004. SS Cendana lets you enjoy a convenient lifestyle with all contemporary conveniences at your disposal.SS Cendana Floor PlanFloor plans clearly depict the room sizes and layout structure of the house, giving you a concise understanding of what it looks like. At SS Cendana, you are offered as many as 3 configuration, available in 4 types of floor plans. The 2 BHK Flat comes with a multitude of size options such as 1450 sq. ft super area. 4 BHK Flat is available in super area of 2500 sq. ft super area. 3 BHK Flat is available in super area of 1450 and 1850 sq. ft super area. Well spaced out balconies and bathrooms with latest fittings provide a truly liberating atmosphere. Magicbricks enumerates different configurations of SS Cendana across a range of unit sizes.SS Cendana BrochureTo get detailed and comprehensive information about $project name you can download the brochure PDF. You can easily find this brochure under the 'Download Brochure' link which is placed on the top right side of the page. To download the brochure of SS Cendana you need to provide details of your name, number and email address.SS Cendana AddressIf you would like to know the complete address for SS Cendana in Gurgaon, it is Sector 83, Gurugram, Haryana 122004, 122004""SS Cendana PriceRs. 1. 54 Cr - 1. 97 CrProject TypeResidentialProperty TypesFlatSS Cendana StatusUnder ConstructionSS Cendana Launch Date01 September 2023SS Cendana Possession Date01 March 2029Towers in SS Cendana12The magnificent SS Cendana that is smartly located in Sector 83, Gurgaon is a well-planned project. Spread over a vast area of 12 Acre, the project is a well-established one. This project encompasses over 1300 units.You could find your perfect sanctuary here, as the project offers different configurations of Flat. The commencement certificate of this well-planned project has been granted. The status of the occupancy certificate of this project not granted. A renowned builder SS Group has crafted SS Cendana with a lot of perfection. The complete address of the site is Sector 83, Gurugram, Haryana 122004. The pin code of this project is 122004. SS Cendana lets you enjoy a convenient lifestyle with all contemporary conveniences at your disposal.Top Amenities in SS CendanaPower Back UpMaintenance StaffWaste DisposalLaundry ServiceInternet/Wi-Fi ConnectivityBanquet HallCafeteria/Food CourtSS Cendana Floor PlanUnit ConfigurationUnit SizeSS Cendana 2 BHK Flat1450. 0 Sq. Ft. - 1450. 0 Sq. Ft.SS Cendana 3 BHK Flat1850. 0 Sq. Ft. - 1850. 0 Sq. Ft.The floor plan is a useful document that gives a realistic idea of the space covered, room sizes and the layout of the house. The properties in SS Cendana have 2 types of configurations and are available in 2 layouts. Bathrooms with contemporary fittings and balconies that allow for easy ventilation are part of the configurations. MagicBricks lists various configurations of different residential units in SS Cendana.SS Cendana BrochureCurious to know more about this state-of-the-art SS Cendana project? Download this detailed PDF to know more. This brochure is available on the top right side of the page under the link 'Download Brochure'. All you need to do is provide your name, email ID and contact number, and you can download the brochure of SS Cendana.SS Cendana AddressSector 83, Gurugram, Haryana 122004, 122004, is the postal address of SS Cendana in Gurgaon.","SS Group33YearsExperience77, SS House,Sector- 44, Gurugram,(Haryana)- 122003","Sector 83,Gurgaon",{}
