title,price,area,property_url,page_number,property_index,scraped_at,posting_date_text,parsed_posting_date,bathrooms,balcony,property_type,furnishing,floor_details,locality,society,status,facing,parking,ownership,transaction,overlooking,data_quality_score,validation_issues,is_valid,amenities,description,builder_name,location_address,specifications
3 BHK Apartment for Sale in Sector 111 Gurgaon,5.20 Cr,1800 sqft,https://www.magicbricks.com/puri-diplomatic-residences-sector-111-gurgaon-pdpid-4d4235343139333031,2,26,2025-08-11 12:26:14.228868,Posted: 12 hours ago,2025-08-11 00:26:14.227851,3.0,3.0,3 BHK,Semi-Furnished,30 out of 33,,Puri Diplomatic Residences,,,2 Covered,Freehold,Resale,"Garden/Park, Pool, Main Road",100.0,[],True,,"About Puri Diplomatic ResidencesPuri Diplomatic Residences is a wonderful residential property that is a tranquil oasis of luxury and comfort. Nestled amidst the vibrant energy of the city, this premium residential development stands out as a testament to sophistication and elegance. Offering a range of luxury apartments at competitive prices, this property redefines modern living with its impeccable design, world-class amenities, and unparalleled attention to detail.Situated in Sector 111, Gurugram, this residential development enjoys a prime location that seamlessly combines accessibility with serenity. Residents benefit from excellent connectivity to key landmarks such as major business hubs, renowned educational institutions, and premium shopping destinations. With easy access to highways and arterial roads, commuting becomes effortless, ensuring that residents can navigate the city with utmost convenience.Puri Diplomatic Residences Sector 111 stands as a masterpiece of architectural brilliance, crafted to harmonize with its surroundings while exuding contemporary allure. The design ethos emphasizes clean lines, expansive spaces, and a seamless integration of indoor and outdoor living. Each apartment is meticulously planned to optimize natural light and ventilation, creating an ambiance of openness and tranquility. From the grand entrance lobby to the intricately landscaped gardens, every aspect of the development reflects a commitment to excellence in design and construction.Step into the world of luxury as you explore the residences at Puri Diplomatic Residences Sector 111 Gurgaon. Offering a diverse range of apartments to suit every lifestyle, each home is a testament to opulence and refinement. Spacious layouts, premium finishes, and thoughtful details elevate the living experience to unparalleled heights. Whether it's a cozy one-bedroom retreat or an expansive apartment with panoramic views, every residence is designed to exceed expectations and cater to the discerning tastes of modern homeowners.At Puri Diplomatic Residences 111 Gurgaon luxury extends beyond the confines of individual residences to encompass a world of exclusive amenities and facilities. Residents can indulge in a plethora of recreational activities, whether it's unwinding by the sparkling swimming pool, staying fit at the state-of-the-art gymnasium, or hosting memorable gatherings at the elegant clubhouse. Lush green spaces, jogging tracks, and children's play areas offer opportunities for relaxation and rejuvenation amidst nature. With round-the-clock security, power backup, and concierge services, every aspect of daily life is seamlessly catered to, ensuring peace of mind and comfort for residents.Beyond the lavish amenities and luxurious residences, this property fosters a sense of community and belonging. Residents come together to form a vibrant and close-knit neighborhood, where friendships flourish and memories are made. From festive celebrations to wellness workshops and cultural events, there's always something happening within the community, creating a lively and engaging atmosphere for all.It offers an unparalleled living experience, The Puri Diplomatic Residences Project in sector 111 presents an excellent investment opportunity for discerning buyers. With Gurugram's real estate market witnessing steady growth and appreciation, investing in a premium development like this property ensures long-term value appreciation and attractive returns. Whether it's for personal use or as a lucrative investment option, owning a property in this esteemed enclave is a decision that promises both luxury living and sound financial gains.Puri Diplomatic Residences PriceRs. 4. 43 Cr - 6. 75 CrProject TypeResidentialProperty TypesFlatPuri Diplomatic Residences StatusUnder ConstructionPuri Diplomatic Residences Launch Date01 February 2024Puri Diplomatic Residences Possession Date01 March 2032Towers in Puri Diplomatic Residences6Puri Diplomatic Residences is conveniently situated in the Sector 111, Gurgaon and is a project that is well planned. Spread over 21 Acre, this project is impressive in its coverage. The entire project consists of over 600 residential units.You could find your perfect sanctuary here, as the project offers different configurations of Flat. Puri Diplomatic Residences project is an offering from the well-established developer Puri Constructions. Strategically located, the complete address of this project is Puri Diplomatic Residences, Sai Kunj, Block C, Sector 111, Choma, Gurugram, Haryana 122001. The project is located at one of the most sought after pin codes that is 122017. Enjoy the comforts of living in Puri Diplomatic Residences with all modern conveniences at your disposal.Top Amenities in Puri Diplomatic ResidencesCentral ACMultipurpose CourtsLiftMeditation AreaOutdoor Tennis CourtsVaastu CompliantSecurityPuri Diplomatic Residences Floor PlanUnit ConfigurationUnit SizePuri Diplomatic Residences 3 BHK Flat2282. 0 Sq. Ft. - 2489. 0 Sq. Ft.Puri Diplomatic Residences 4 BHK Flat2475. 0 Sq. Ft. - 3475. 0 Sq. Ft.Floor plans tell you exactly how big or small the rooms or spaces in a house are, and so are the perfect way to get an understanding of the house layoutPuri Diplomatic Residences boasts of having 2 configurations available in 7 types of immaculately designed layouts. These configurations come with well-fitted bathrooms and accessible balconies. You can view differnt configurations across unit sizes of Puri Diplomatic Residences on Magicbricks.Puri Diplomatic Residences BrochureWant to learn more about the well-planned Puri Diplomatic Residences project? Download their detailed PDF brochure. This brochure can be easily accessed from the top right end of the page, where you will see the link of 'Download Brochure'. To download the Puri Diplomatic Residences brochure, you will have to provide the basic details such as your name, contact details and email address.Puri Diplomatic Residences AddressPuri Diplomatic Residences, Sai Kunj, Block C, Sector 111, Choma, Gurugram, Haryana 122001, 122017, is the complete address of Puri Diplomatic Residences",Puri Constructions,"Sector 111,Gurgaon",{}
4 BHK Builder Floor for Sale in Sector 66 Gurgaon,5.35 Cr,1542 sqft,https://www.magicbricks.com/emaar-mgf-marbella-sector-66-gurgaon-pdpid-4d4235303232343438,2,27,2025-08-11 12:26:14.230378,Updated 7 hours ago,2025-08-11 05:26:14.229395,3.0,3.0,4 BHK,Semi-Furnished,2 out of 4,,Emaar MGF Marbella,Ready to Move,,,,Resale,,89.5,[],True,,"About Emaar MGF MarbellaWelcome to a lifestyle designed to satiate all your senses. A space exquisitely shaped to transform every moment into a treasure. In a setting that is far from the crowd, yet close to all you desire. Step in, and the lavishly appointed interiors transport you into a higher realm of luxury. Walk out, and the skilfully landscaped greens fill you with a sense of rapture. Every exquisite little detail gives you a glimpse of the passion and craft that has shaped it. This is Marbella. Opulence redefined. Fully air conditioned with 100% power back up, concierge, best in class facility management services, premium finishes with dedicated elevator and best in class clubhouse truly defines your way of living.Emaar MGF Marbella StatusReady To MoveEmaar MGF Marbella Launch Date01 September 2013Emaar MGF Marbella Possession Date01 October 2022Positioned at well connected locality Sector 66, Emaar MGF Marbella is an aesthetically built project of Gurgaon. Spanning across 108 Acre, the project is well-spaced out. The project has a total of 268 units, constructed with robust quality.The commencement certificate of the impressive Emaar MGF Marbella project has been grantedThe project's occupancy certificate granted. A renowned builder Emaar India has crafted Emaar MGF Marbella with a lot of perfection. The site's exact address is Phase 2, Sector 65, Golf Course Extension Road, Gurugram. Its pincode is 122102. At Emaar MGF Marbella, you can enjoy a modern lifestyle as all conveniences are easily available.Top Amenities in Emaar MGF MarbellaPower Back UpIntercom FacilityMaintenance StaffLaundry ServiceInternet/Wi-Fi ConnectivityDTH Television FacilityRO Water SystemEmaar MGF Marbella BrochureYou can get all details of Emaar MGF Marbella by downloading their PDF brochure here. To download, navigate to the top right end of the page and hit the 'Download Brochure' link. To download the Emaar MGF Marbella brochure, you will have to provide the basic details such as your name, contact details and email address.Emaar MGF Marbella AddressPhase 2, Sector 65, Golf Course Extension Road, Gurugram, 122102, is the complete address of Emaar MGF Marbella",Emaar India15YearsExperience,"Sector 66,Gurgaon",{}
4 BHK Builder Floor for Sale in Sector 63A Gurgaon,3.15 Cr,1776 sqft,https://www.magicbricks.com/anant-raj-estate-sector-63a-gurgaon-pdpid-4d4235303233383439,2,29,2025-08-11 12:26:14.232595,Updated 9 hours ago,2025-08-11 03:26:14.231559,4.0,2.0,4 BHK,Semi-Furnished,2 out of 4,,Anant Raj Estate,Ready to Move,South,,Freehold,New Property,Main Road,105.3,[],True,,"About Anant Raj EstateAnant Raj Estate, with its high-end infrastructure and world-class facilities, has truly epitomized luxury and extravagant livelihood to embark on its lavish venture in Gurugram. It is a true manifestation of its core theme: “Recreating Delhi’s Original Charm” and extends its horizon beyond a regular housing society genre. Spreading out on lush green open spaces of opulence and leisure, Anant Raj Estate is urbanised to deliver an entirely new living experience beyond comparison.Our glorious Project encompasses a master-designed community that assimilates numerous pockets of development in a Gated Township. It carries an eco-friendly design and neo-classical architecture with a unique and opulent regime. With a plethora of stellar conveniences just nearby from your home, it is an ideal dream living space for you to start a new, more comfortable phase of your life in. Not only that, it puts our resident’s security as a priority with advanced security systems, 24X7 power back-up and round-the-clock facilities management. Immerse yourself in an ideal living scenario that is meant to inspire an active way of life, comfort and luxury.Anant Raj Estate PriceRs. 2. 25 Cr - 2. 60 CrProject TypeResidentialProperty TypesBuilder FloorAnant Raj Estate StatusReady To MoveAnant Raj Estate Launch Date01 April 2013Anant Raj Estate Possession Date01 July 2017Anant Raj Estate is a well-planned project that is ideally positioned in Sector 63A, Gurgaon. It covers an area of 1 Acre giving enough green space to residents. The property comprises of 233 units which are enclosed within a peaceful environment.The project offers property options such as Builder Floor which are unparalleled and value for money. The commencement certificate of the impressive Anant Raj Estate project has been grantedThe occupancy certificate of the project granted. A renowned builder Anant Raj Limited has crafted Anant Raj Estate with a lot of perfection. You can reach out to this project at Sector 63A, Gurugram, Haryana. The project is located at one of the most sought after pin codes that is 122102. With all modern conveniences at your disposal, Anant Raj Estate will ensure a quality living experience.Top Amenities in Anant Raj EstatePower Back UpDTH Television FacilityBanquet HallJogging and Strolling TrackFlower GardensIndoor Games RoomIndoor Squash & Badminton CourtsAnant Raj Estate Floor PlanUnit ConfigurationUnit SizeAnant Raj Estate 3 BHK Builder Floor1450. 0 Sq. Ft. - 1680. 0 Sq. Ft.Anant Raj Estate 4 BHK Builder Floor1776. 0 Sq. Ft. - 2430. 0 Sq. Ft.Floor plans clearly depict the room sizes and layout structure of the house, giving you a concise understanding of what it looks like. You can view different configurations across unit sizes of Anant Raj Estate on Magicbricks. The configurations include well-equipped bathrooms and balconies that allow for easy ventilation. The different types of unit sizes of Anant Raj Estate can be viewed on MagicBricks.Anant Raj Estate BrochureWant to learn more about the well-planned Anant Raj Estate project? Download their detailed PDF brochure. This brochure is available on the top right side of the page under the link 'Download Brochure'. You will need to fill in your contact details as name, number and email ID to be able to view the PDF brochure of Anant Raj Estate.Anant Raj Estate AddressIf you would like to know the complete address for Anant Raj Estate in Gurgaon, it is Sector 63A, Gurugram, Haryana, 122102",Anant Raj Limited,"Sector 63A,Gurgaon",{}
3 BHK Apartment for Sale in Phase 2 Greenopolis Gurgaon,2 Cr,1450 sqft,https://www.magicbricks.com/orris-3c-greenopolis-sector-89-gurgaon-pdpid-4d4235303238343130,3,1,2025-08-11 12:26:18.353726,Updated 3 hours ago,2025-08-11 09:26:18.352697,3.0,3.0,3 BHK,Unfurnished,14 out of 14,,Orris 3c Greenopolis,Ready to Move,West,,Leasehold,New Property,Garden/Park,105.3,[],True,,"About 3c GreenopolisOverview:Orris Infrastructure Pvt Ltd. Sector 89, Gurgaon is believes in leaving an everlasting fragrance in the minds of its customers, just like the extraordinary rare flower Orris.3c Greenopolis at Sector 89 , Gurgaon, offers high-end yet affordable apartment options ranging between INR 63.5 Lac - 1.03 Cr..Focusing on the efficient use of energy, water and building material, Greenopolis is an innovative blend of efficient technologies creating an eco-friendly habitat. The project offers spacious 1862 units in 2 and 3 BHK flats in Sector 89, Gurgaon divided into 27 huge towers. As per the 3c Greenopolis construction update the 3 BHK flats are still under construction with the estimated time of possession between by December 2018.About the Project:Orris 3C Greenopolis apartments is an image of the modern lifestyle in Gurgaon. The project offers thoughtfully planned homes, each giving you an elegant and luxurious feel. The 3c Greenopolis 2BHK resale flats are built on an area between 1297 sqft and 1660 sqft and the 3 BHK flats have an area between 1910 sqft and 2070 sqft. The developers have made sure that you have your privacy by constructing segregated apartments.3c Greenopolis reviews indicates the apartments are beautifully designed with the aim to provide houses that are spacious, vastu compliant and offers unmatched quality. Some of the modern amenities provided by the project are club house, lift, round the clock security, maintenance staff, reserved and visitor parking, kids play area, fire fighting equipment, etc. With 2 open sides, the flats in the project enjoy ample daylight and beautiful views of the surroundings.Highpoints:3c Greenopolis has many famous schools, hospitals, shopping destinations, tech parks and every public amenity required in the vicinity ensuring that you don’t have to roam around for the basic amenities.The updated 3c Greenopolis photos will give you more information about the project. Dont wait for long. Go book your dream flat now3c Greenopolis PriceRs. 1. 64 Cr - 1. 75 CrProject TypeResidentialProperty TypesFlat3c Greenopolis StatusReady To Move3c Greenopolis Launch Date01 December 20133c Greenopolis Possession Date01 December 2020Towers in 3c Greenopolis28Situated in Sector 89, the 3c Greenopolis is planned to offer a modern lifestyle to all the residents. Spread over 37 Acre, this project is impressive in its coverage. The property comprises of 2317 units which are enclosed within a peaceful environment.The project boasts of a range of configurations viz Flat which are charming, yet durable. 3c Greenopolis has not been granted its commencement certificate. The occupancy certificate also not granted. 3c Greenopolis has been built by reputed real estate developer Orris Infrastructure Pvt Ltd. The site's complete address is SECTOR-89, MANESAR, GURUGRAM. This project comes under the pincode of 122004. Enjoy the comforts of living in 3c Greenopolis with all modern conveniences at your disposal.Top Amenities in 3c GreenopolisEarth quake resistantOutdoor Tennis CourtsMaintenance StaffVisitor ParkingSecurityReserved ParkingFire Fighting Equipment3c Greenopolis Floor PlanUnit ConfigurationUnit Size3c Greenopolis 3 BHK Flat1910. 0 Sq. Ft. - 2036. 0 Sq. Ft.Floor plans are the perfect way to understand how the spaces/rooms of 3c Greenopolis are structured and help provide a clear picture of the house layout. The properties in 3c Greenopolis are available in 1 configurations and 3 varied layouts (or floor plans), The configurations include well-equipped bathrooms and balconies that allow for easy ventilation. Magicbricks presents to you a range of layouts across different units of 3c Greenopolis.3c Greenopolis BrochureGet a comprehensive and detailed overview of 3c Greenopolis by downloading their PDF BrochureThis brochure can be easily accessed from the top right end of the page, where you will see the link of 'Download Brochure'. The brochure of 3c Greenopolis can be viewed by giving your contact details of name, email and phone or mobile number.3c Greenopolis AddressWish to have a look and feel of the 3c Greenopolis project? Reach out at SECTOR-89, MANESAR, GURUGRAM, 122004.",Orris Infrastructure Pvt Ltd19YearsExperience,"Sector 89,Gurgaon",{}
3 BHK Apartment for Sale in Sector 63A Gurgaon,3.15 Cr,1900 sqft,https://www.magicbricks.com/signature-global-city-63a-sector-63a-gurgaon-pdpid-4d4235333333323633,3,2,2025-08-11 12:26:18.355275,Updated 4 hours ago,2025-08-11 08:26:18.354323,3.0,2.0,3 BHK,Semi-Furnished,4 out of 4,,Signature Global City 63A,Ready to Move,North,,Freehold,Resale,Garden/Park,105.3,[],True,,"About Signature Global City 63AStart your Independent Innings at a place as unique as you, at Signature Global City 63 A. One of the most respected leaders in realty, Signature Global offers you high-quality, luxury apartments at a green, urban location. Designed by the renowned interior designer Sonali Bhagwati, these apartments are envisioned to be the embodiment of perfection like a solitaire. Here, everything around you will motivate you to build that exclusive life you always dreamt of; to live on your own terms surrounded by world-class amenities and high-end security2&3 BHK PREMIUM INDEPENDENT FLOORS AT GOLF COURSE EXTENSION ROADSignature Global City 63A PriceRs. 2. 15 Cr - 4. 67 CrProject TypeResidentialProperty TypesBuilder FloorSignature Global City 63A StatusUnder ConstructionSignature Global City 63A Launch Date01 March 2022Signature Global City 63A Possession Date01 February 2026Towers in Signature Global City 63A4Signature Global City 63A is a well-planned project that is ideally positioned in Sector 63A, Gurgaon. It is spread out over a large area of 5 Acre. The entire project consists of over 288 residential units.The different types of units available are Builder Floor, which have been designed to offer complete satisfaction. A renowned builder Signature Global has crafted Signature Global City 63A with a lot of perfection. The complete address of the site is 93VR+HF7, Sector-63A, Kadarpur, Haryana - 122102. The required pincode of the project is 122102. With all modern conveniences at your disposal, Signature Global City 63A will ensure a quality living experience.Top Amenities in Signature Global City 63APower Back UpMaintenance StaffWaste DisposalLaundry ServiceDTH Television FacilityRO Water SystemBar/LoungeSignature Global City 63A Floor PlanUnit ConfigurationUnit SizeSignature Global City 63A 2 BHK Builder Floor1050. 0 Sq. Ft. - 1706. 0 Sq. Ft.Signature Global City 63A 3 BHK Builder Floor1227. 0 Sq. Ft. - 1920. 0 Sq. Ft.To know more about the layout, it is best to study the floor plan. The floor plan provides a bird's eye view of the house structure. You can view different configurations across unit sizes of Signature Global City 63A on Magicbricks. Well-appointed bathrooms and balconies with a view are part of these units. You can view various layouts across different units sizes of Signature Global City 63A on Magicbricks.Signature Global City 63A BrochureTo have a detailed look at the features of the marvelous Signature Global City 63A project, download its all encompassing pdf. The download link is seamlessly available at the top right hand side of the page under 'Download Brochure' tab. All you need to do is provide your name, email ID and contact number, and you can download the brochure of Signature Global City 63A.Signature Global City 63A AddressSignature Global City 63A is one of the most sought after projects of city. It is located at 93VR+HF7, Sector-63A, Kadarpur, Haryana - 122102, 122102.","Signature Global11YearsExperienceUnit No.101, Ground Floor, Tower-A,Signature Tower South City-1, Gurugram, Haryana 122 001, India","Sector 63A,Gurgaon",{}
3 BHK Apartment for Sale in Sector 79 Gurgaon,2.65 Cr,1560 sqft,https://www.magicbricks.com/bestech-altura-sector-79-gurgaon-pdpid-4d4235303839373234,3,3,2025-08-11 12:26:18.356899,Posted: 1 hour ago,2025-08-11 11:26:18.355841,3.0,2.0,3 BHK,Semi-Furnished,7 out of 19,,Bestech Altura,Ready to Move,West,,Freehold,New Property,Main Road,105.3,[],True,,"About Bestech AlturaBestech Altura is the best luxurious residential property which offers 3 BHK and 4 BHK spacious flats in Sector 79, Gurugram.Altura offers you to be a part of an active community where you nestle amidst Aravalli Hills and listen to the eloquence of serenity where you begin your journey to live anew.Live in an apartment enveloped by nature and be the best version of yourself. Your active lifestyle is waiting for you, just outside your door. Altura offers you a home which is surrounded by nature, and has all kinds of activities you can indulge in.What are you waiting for? Just grab your running shoes or your favourite yoga mat, and GET.SET.GO!Bestech Altura, active homes for active living.FEATURES10.1 Acres108 mts tall building521 Units13 Water bodiesYoga CentrePool TableKids Play AreaGym CornerHealth ZoneSpa & Sauna FacilityCafeteriaAMENITIESCLUBSWIMMING POOLKIDS POOLAMPHITHEATRESCHOOLSHOPSMINI SOCCER FIELDBASKETBALL COURTTENNIS COURTBADMINTON COURTOUTDOOR GYMCHILDREN PLAY AREAYOGA HUTJOGGING TRACKLOCATION ADVANTAGES01 - 05 minutesSouth DelhiCricket GroundIT/SEZGolf Course05 - 10 minutesShopping MallHotels & RestaurantsHospitals & Clinics15 - 20 minutesInternational AirportFaridabadBestech Altura PriceRs. 2. 59 Cr - 3. 87 CrProject TypeResidentialProperty TypesFlatBestech Altura StatusUnder ConstructionBestech Altura Launch Date01 August 2022Bestech Altura Possession Date01 December 2026Towers in Bestech Altura7Bestech Altura is conveniently situated in the Sector 79, Gurgaon and is a project that is well planned. Spanning across 10 Acre, the project is well-spaced out. The project has a total of 520 units, constructed with robust quality.The project offers property options such as Flat which are unparalleled and value for money. The commencement certificate of this well-planned project has been granted. The occupancy certificate of this modern project not granted. Bestech Altura project is an offering from the well-established developer Bestech Group. Strategically located, the complete address of this project is Sector 79, Gurgaon, Haryana. The project's pin code is 122004. At Bestech Altura, a quality living is guaranteed by modern amenities and healthy surroundings.Top Amenities in Bestech AlturaPrivate Terrace/Garden3 Tier Security SystemPremium branded fittingsParkIndoor Squash & Badminton CourtsEvent Space & AmphitheatreAEROBICS ROOMBestech Altura Floor PlanUnit ConfigurationUnit SizeBestech Altura 3 BHK Flat2015. 0 Sq. Ft. - 2150. 0 Sq. Ft.Bestech Altura 4 BHK Flat2675. 0 Sq. Ft. - 2675. 0 Sq. Ft.To get an idea of the space covered, layout and room sizes, browsing through the floor plan would help. There are 2 configurations in 4 different types of layouts across the different properties in Bestech Altura. Bathrooms and balconies are a part of these configurations. MagicBricks lists various configurations of different residential units in Bestech Altura.Bestech Altura BrochureIf Bestech Altura appeals to you, learn more about this well-designed project by downloading their PDF brochure. The brochure is accessible from the top right end of the page, under the link 'Download Brochure'You can have access to the brochure of Bestech Altura by providing details such as your name, email address and contact details.Bestech Altura AddressThe Bestech Altura is strategically located at Sector 79, Gurgaon, Haryana, 122004.",Bestech Group35YearsExperience,"Sector 79,Gurgaon",{}
