title,price,area,property_url,page_number,property_index,scraped_at,posting_date_text,parsed_posting_date,bathrooms,balcony,property_type,furnishing,floor_details,locality,society,status,facing,parking,ownership,transaction,overlooking,data_quality_score,validation_issues,is_valid,amenities,description,builder_name,location_address,specifications
"4 BHK Apartment for Sale in Fazilpur Jharsa, Sector 72, Sohna Road Gurgaon",6 Cr,2080 sqft,https://www.magicbricks.com/tata-primanti-fazilpur-jharsa-gurgaon-pdpid-4d4235303030313431,2,7,2025-08-11 12:26:14.201997,Updated 7 hours ago,2025-08-11 05:26:14.200911,4.0,4.0,4 BHK,Semi-Furnished,19 out of 38,,Tata Primanti,Ready to Move,North - East,2 Covered,Freehold,Resale,Garden/Park,110.5,[],True,,"About Tata PrimantiOverviewTata Primanti at Sector 72 , Gurgaon, offers amazing luxury flats options ranging between Rs. 4.37 Cr - 14.57 Cr.Ideally positioned on the Southern Peripheral Road in Sector 72, Gurgaon, Tata Primati, offers 41 luxuriously designed towers surrounded by tree-lined boulevards with $unit units occupying space in them. Splendidly designed 3BHK and 4BHK units are provided in the price range varying between Rs. 4.37 Cr - 14.57 Cr. This residential development is spread across 36 acres and besides these apartments, it also offers penthouses, executive apartments executive floors.About the ProjectEnsconced in the lap of verdant greens where private gardens, terraces and courtyards form an integral part of this superbly developed project. This project offers residences segregated into executive floor, executive apartments and tower residences. The executive floors are duplexes featuring 4 bedrooms along with landscaped gardens or open terrace. Executive residential apartments are housed in mid-rise buildings with one apartment on each floor and are available in the configuration of 4BHK.These apartments are open on three sides. There is an option to opt for penthouse units available on two levels as well. Tower Residences offer lavishly appointed residential apartments in the configuration of 3BHK and 4BHK units. 30 and 40 storey high rise towers house these residences offering magnificent views of the city skyline. 3BHK residential apartments as part of Tower Residences are sized at 2185sq.ft. while 4BHK apartments cover an area that ranges between 2625sq.ft. and 2902sq.ft. The executive apartments and executive floors are available in the area size that ranges between 3250sq.ft. and 4500sq.ft.HighpointsHigh-end luxurious amenities constitute the USP of this project, as one can enjoy various recreational and sporting facilities at state-of-the-art clubhouse and sporting zone featuring swimming pool, gym, entertainment room, sauna and steam, aqua gym, squash and badminton courts. Proximity to NH8 further provides easy access to business centers, airport and shopping malls.Tata Primanti PriceRs. 4. 37 Cr - 14. 57 CrProject TypeResidentialProperty TypesFlat, VillaTata Primanti StatusReady To MoveTata Primanti Launch Date01 June 2011Tata Primanti Possession Date01 January 2016Towers in Tata Primanti41Positioned at well connected locality Sector 72, Tata Primanti is an aesthetically built project of Gurgaon. This project has its expanse over an area of 36 Acre. The project features a total of 1105 units that are well-ventilated.The different types of units available are Flat, Villa, which have been designed to offer complete satisfaction. The commencement certificate has been granted of Tata Primanti. The status of the occupancy certificate of this project granted. Tata Primanti has been developed by the well-known builder TATA Housing Development Company Ltd. . Planning to invest in this exclusive property? You can visit the property at Southern Peripheral Rd, Phase 2, Tatvam Villas, Dhani, Sector 72, Gurugram. The project is located at one of the most sought after pin codes that is 122004. Tata Primanti offers a contemporary lifestyle to its residents and is the perfect place to own your dream home.Top Amenities in Tata PrimantiPrivate jaccuziDTH Television FacilityBar/LoungePiped GasJogging and Strolling TrackOutdoor Tennis CourtsPower Back UpTata Primanti Floor PlanUnit ConfigurationUnit SizeTata Primanti 3 BHK Flat2185. 0 Sq. Ft. - 2185. 0 Sq. Ft.Tata Primanti 4 BHK Villa3250. 0 Sq. Ft. - 8500. 0 Sq. Ft.Tata Primanti 4 BHK Flat2625. 0 Sq. Ft. - 2905. 0 Sq. Ft.The floor plan is a useful document that gives a realistic idea of the space covered, room sizes and the layout of the house. At Tata Primanti you can choose from 3 configurations that are available in 8 types of floor plans or layouts. Well spaced out balconies and bathrooms with latest fittings provide a truly liberating atmosphere. The various types of floor plans of different units in Tata Primanti can be viewed on MagicBricks.Tata Primanti BrochureCurious to know more about this state-of-the-art Tata Primanti project? Download this detailed PDF to know more. The brochure can be viewed at the top right side of the page under the link 'Download Brochure'. Just enter the details like name, email address and contact details and you can download the brochure of Tata Primanti.Tata Primanti AddressWish to have a look and feel of the Tata Primanti project? Reach out at Southern Peripheral Rd, Phase 2, Tatvam Villas, Dhani, Sector 72, Gurugram, 122004.",TATA Housing Development Company Ltd.41YearsExperience,"Sector 72,Gurgaon",{}
2 BHK Apartment for Sale in Sector 68 Gurgaon,1.50 Cr,800 sqft,https://www.magicbricks.com/m3m-marina-sector-68-gurgaon-pdpid-4d4235303732323235,2,8,2025-08-11 12:26:14.203683,Updated 7 hours ago,2025-08-11 05:26:14.202628,2.0,,2 BHK,Furnished,15 out of 21,,M3M Marina,Ready to Move,,1 Covered,Freehold,Resale,Garden/Park,100.0,[],True,,"About M3M MarinaOverview:M3M Marina in Sector 68 , Gurgaon has apartments available at an affordable budget range between INR 79.8 Lac - 1.23 Cr..M3M Marina is a project situated in the fast growing locality of Sector 68, Gurgaon by M3M India offering skillfully crafted and spaciously designed 2 BHK and 3 BHK apartments. The project consists of 1150 units spanned over 10 meticulously planned towers and is currently under construction. M3M Marina Gurgaon is fully equipped with all amenities and close by various basic civic utilities.Project Details:M3M Marina by M3M India is offering skillfully crafted and spaciously designed 2 BHK and 3 BHK apartments in the main locality of Sector 68, Gurgaon. M3M Marina floor plans for its 2 BHK flat ranges from 1260 sq. ft. to 1304 sq. ft.; and 3 BHK flat areas range from 1550 sq. ft. to 1914 sq. ft.Apartments in M3M Marina are designed with vitrified tiles and anti skid ceramic tiles flooring in all rooms, laminated wooden flooring in all bedrooms, hardwood frame doors, concealed electrical wiring with modular switches, polished granite kitchen platform with stainless steel sink, wooden windows with grills, bathroom with branded CP fittings and sanitary ware fixtures etc.M3M Marina features various modern day amenities and facilities for its residents such as a club house, cafeteria, jogging & strolling track, outdoor tennis court, power back up, 24 hour security facilities, service & goods lift, reserved parking, maintenance staff, gymnasium, indoor games room, kids play area, rain water harvesting, water storage, and fire fighting equipment etc. to name a few.Highpoints:M3M Marina photos show the apartment is well ventilated and abundant natural light. The residents can enjoy all kinds of amenities and a scenic view of the surroundings. M3M Marina Gurgaon locality has landmarks and civic utilities in close vicinity such as Tigra More Bus Stop, Lotus Valley International School, Artemis Hospitals, SRS Value Bazaar, Domino's Pizza, and Apollo Pharmacy etc.M3M Marina PriceRs. 1. 90 Cr - 2. 34 CrProject TypeResidentialProperty TypesFlatM3M Marina StatusReady To MoveM3M Marina Launch Date01 September 2016M3M Marina Possession Date01 January 2022Towers in M3M Marina10Favourably located in Sector 68 in Gurgaon, M3M Marina is a meticulously planned project. Spread over 13 Acre, this project is impressive in its coverage. This project has a total of 1100 units.The project offers property options such as Flat which are unparalleled and value for money. The commencement certificate of M3M Marina has not been granted. And the occupancy certificate not granted too. Known for their quality constructions M3M India Pvt. Ltd. has developed M3M Marina project. M3M Marina, Residential complex, Sector 68, Gurugram, Haryana is the full address of the site. The pin code of this masterpiece project is 122101. At M3M Marina, you can enjoy a modern lifestyle as all conveniences are easily available.Top Amenities in M3M MarinaMini Cinema TheatreFire Fighting EquipmentCafeteria/Food CourtJogging and Strolling TrackOutdoor Tennis CourtsEarth quake resistantArts & Craft StudioM3M Marina Floor PlanUnit ConfigurationUnit SizeM3M Marina 3 BHK Flat1595. 0 Sq. Ft. - 1914. 0 Sq. Ft.Floor plans are the perfect way to understand how the spaces/rooms of M3M Marina are structured and help provide a clear picture of the house layout. You can view different configurations across unit sizes of M3M Marina on Magicbricks. The configurations include well-equipped bathrooms and balconies that allow for easy ventilation. The different types of unit sizes of M3M Marina can be viewed on MagicBricks.M3M Marina BrochureIf M3M Marina appeals to you, learn more about this well-designed project by downloading their PDF brochure. This brochure is available on the top right side of the page under the link 'Download Brochure'. To download the brochure of M3M Marina you need to provide details of your name, number and email address.M3M Marina AddressIf you would like to know the complete address for M3M Marina in Gurgaon, it is M3M Marina, Residential complex, Sector 68, Gurugram, Haryana, 122101","M3M India Pvt. Ltd.37YearsExperienceM3M India Pvt. Ltd, 23rd Floor, Windsor IT Park, A-1, Sector-125, Noida - 201301","Sector 68,Gurgaon",{}
4 BHK Apartment for Sale in Sector 90 Gurgaon,3.30 Cr,1800 sqft,https://www.magicbricks.com/dlf-regal-gardens-sector-90-gurgaon-pdpid-4d4235303238333839,2,9,2025-08-11 12:26:14.205269,Updated 7 hours ago,2025-08-11 05:26:14.204292,3.0,,4 BHK,Semi-Furnished,7 out of 11,,DLF Regal Gardens,Ready to Move,North,,Freehold,Resale,,94.7,[],True,,"About DLF Regal GardensDLF Regal Gardens is designed to offer you the absolute comfort and convenience you seek. Majestically overlooking the edge of Gurugram's glorious skyline, the luxury homes here personify your identity.DLF Regal Gardens in Sector 90 , Gurgaon has apartments available at an affordable budget range between INR 89.0 Lac- 1.60 Cr..Located in the heart of DLF Garden City, Regal Gardens surrounds you with a vibrant community setting with world-class facilities and a superlative lifestyle.DLF Regal Gardens PriceRs. 1. 74 Cr - 2. 29 CrProject TypeResidentialProperty TypesFlatDLF Regal Gardens StatusReady To MoveDLF Regal Gardens Launch Date01 March 2012DLF Regal Gardens Possession Date01 December 2016Towers in DLF Regal Gardens8DLF Regal Gardens is strategically located in Sector 90 in the city of Gurgaon and is a well-planned project. It covers an area of 11 Acre that is well-maintained. This project has a total of 562 units.The property features various unit types as Flat, which are constructed to offer complete satisfaction. DLF Regal Gardens has been granted its commencement certificate. The project's occupancy certificate granted. DLF Regal Gardens is smartly developed by the well-known builder DLF Ltd. . The complete address of the site is Sector 90, Gurugram, Haryana. This project comes under the pincode of 122505. DLF Regal Gardens spells convenience and comfort at a competitive price.Top Amenities in DLF Regal GardensLiftClub HouseBanquet HallMultipurpose HallFire Fighting EquipmentIndoor Games RoomCCTV CameraDLF Regal Gardens Floor PlanUnit ConfigurationUnit SizeDLF Regal Gardens 3 BHK Flat1693. 0 Sq. Ft. - 1818. 0 Sq. Ft.Floor plans clearly depict the room sizes and layout structure of the house, giving you a concise understanding of what it looks like. The properties in DLF Regal Gardens are available in 1 configurations and 3 varied layouts (or floor plans), There are well-laid out balconies and modern bathrooms with all these configurations. You can view differnt configurations across unit sizes of DLF Regal Gardens on Magicbricks.DLF Regal Gardens BrochureDownload the PDF brochure of DLF Regal Gardens and get the complete details of this beautifully constructed project. This brochure can be easily accessed from the top right end of the page, where you will see the link of 'Download Brochure'. Simply fill in your details as name, email ID and contact number and view the brochure of DLF Regal Gardens.DLF Regal Gardens AddressSector 90, Gurugram, Haryana, 122505, is the postal address of DLF Regal Gardens in Gurgaon.","DLF Ltd.75YearsExperienceDLF Gateway Tower, R Block,DLF City Phase - III,Gurugram - 122002, Haryana","Sector 90,Gurgaon",{}
Plot/Land for Sale in Sector 109 Gurgaon,9.38 Cr,4968 sqft,https://www.magicbricks.com/experion-the-westerlies-sector-109-gurgaon-pdpid-4d4235303131353736,2,11,2025-08-11 12:26:14.207205,Updated 7 hours ago,2025-08-11 05:26:14.206416,,,Plot,,,,Experion The Westerlies,,75 m,,,Resale,,68.4,[],True,,"About The WesterliesExperion The Westerlies is a serene and luxurious residential plots project that strives to nurture the homeowners with enough space and greenery. Located in Sector 108, Gurgaon, it is 0 km away from Delhi making the daily commute quite easy. The property is spread over 100 acres, giving the space needed for a comfortable living. This one-of-a-kind project also includes 100% power backup and The Breeze, a kilometre-long pathway filled with various types of flora.Living in a property spread over 10.3 acres of Green Boulevard also means breathing in fresh air and living amidst natural beauty. Designed by Experion, The Westerlies is designed for a private living experience that offers you a space full of diverse flora and fauna. A holistic living experience is ensured by modern facilities for children, futuristic town planning, and a well-balanced neighbourhood.Land – 100 AcresUnits – 260Space Configuration – PlotsRERA certificate number – 103 of 2017, 67 of 2019About Experion The WesterliesLocated in Gurgaon, Experion The Westerlies is designed for luxury living in every aspect. The personalisation of spaces is possible as you are buying plots and not pre-designed homes that you might need to renovate. These plots are priced from Rs 1.77 crore to Rs 3.03 crore. The easy accessibility is commendable and has multiple amenities that will ease your living experience.It has an internationally acclaimed water management system with stormwater drainage. If you want a beautiful garden adjacent to your home or parking, you have the choice to do so. Be it a big library or an entertainment unit for parties, you can build anything to your liking.Experion The Westerlies is adjacent to the Green Reserve Zone in Delhi. The project is designed to be able to breathe in fresh air and live to the fullest. A 10-acre green boulevard with a km-long pathway is situated for you to experience it on the go. There is a 1.1 km long open green space inside the vicinity that is called The Breeze. The Westerlies has its own streets namely – Mulberry Drive, Chestnut Avenue, Cypress Lane and The Breeze. Spread over 100 acres, there are about 260 units that share over 20 amenities including a reflexology park and gazebo.The extensive project has ready-to-move units as the occupancy certificate is granted. The project offers residential plots in varying sizes from 1629 sq. ft to 3105 sq. ft. The project was launched in August 2017. Experion Developers Pvt Ltd, a well-known real estate developer, constructed The Westerlies. The Westerlies ensures that first-rate premium amenities are available.Experion The Westerlies Floor PlanExperion The Westerlies is intended for an uninterrupted, private living while preserving the grandeur of the natural experience. It has over 20 amenities as well as stunning views.AmenitiesThe Breeze – open green spaceFlower GardensMeditation AreaMultipurpose HallEvent Space and AmphitheatreCycling and Jogging TrackReflexology ParkPower Back-upChildren’s Play AreaPaved CompoundThree Tier Security SystemGated CommunityPhysical InfrastructureThe Westerlies is situated in Sector 108 which is a developing sector that is conveniently located just 3 km from the Dwarka Expressway. It is surrounded by several villages and new sectors, including Nankheri, Babupur and Sectors 106, 107, and 109. Due to its convenient location near the Dwarka Expressway, Sector 108 has seen significant development when it comes to real estate.In addition, the Gurgaon Railway Station is only 5 km away and can be reached in about 15 minutes. In addition, IGI Airport is only 20 km away and can be reached within 30-40 minutes. Sector 108 is connected to Najafgarh Kapashera Road by a road that runs adjacent to it.Social & retailSector 108's social and retail infrastructure is well developed as a result of its prominent residential neighbourhood. Institutions, shopping malls, and healthcare facilities are nearby.•              Greenwood Public School•              Metro Hospital and Heart Institute•              Royal Oak International School•              Ambience Mall•              MGF Metropolitan Mall•              Blue Bells Model School•              Global Multispeciality Hospital•              Cyber Hub•              Columbia Asia HospitalNearby employees’ hubsNear The Westerlies, a prime employees' hub is located with a well-developed commercial infrastructure.•         Udyog Vihar•         Infotech Centre•         Platinum Tower•         Unitech Infospace•         Cybercity•         Building Candor Tech SpaceSpecifications of Experion The WesterliesDesigned for abundant living that is equipped with several beautiful open spaces, it has a reflexology park and meditation area. The Westerlies has over 10 acres of the green boulevard that remains unmatched. The property comes with wide roads that run internally. There are plots of varying sizes for your dream house to be built.Experion The WesterliesBrochureThe project brochure can be quickly and easily downloaded. The brochure can be found on the upper right side of the website, directly beneath the ""Download Brochure"" link. After providing your contact information, which should include your name, phone number, and email address, you can download the Experion The Westerlies Brochure.Experion The Westerlies Address46 Banyan Tree is located at a prime location in Delhi. The full address is The Westerlies,Sector 108, 75m road Dwarka Expressway, Gurgaon, Haryana 122006Project Advantage•              Made by renowned architects•              100 acres of a gated community with holistic design•              Villa plots with world-class amenities•              46 acres of a gated community with security•              The Breeze – 1.1. km long green open space•              Amphitheatre and meditation areasLocation Advantages•              0 km from Delhi Border•              20 km from Indira Gandhi International (IGI) Airport•              0 km from Delhi Green Reserve•              3 km from Dwarka Expressway•              5 km from Gurgaon Railway Station•              17 km from Ambience Mall•              19 km from Cyber Hub•              13 km from MGF Metropolitan Mall•              15 km from Platinum Tower•              15 km from Infotech CentreProject TypeResidentialProperty TypesResidential PlotThe Westerlies StatusReady To MoveThe Westerlies Launch Date01 November 2015The Westerlies Possession Date01 March 2018The Westerlies is a well-planned project that is ideally positioned in Sector 108, Gurgaon. This project has its expanse over an area of 150 Acre. There are total 200 units in the project that are designed keeping the modern lifestyle in mind.You could find your perfect sanctuary here, as the project offers different configurations of Residential Plot. This world class The Westerlies has been granted. its commencement certificate. The project's occupancy certificate granted. The Westerlies project is an offering from the well-established developer Experion Developers Pvt Ltd. Strategically located, the complete address of this project is Plot No. 18, 2nd Floor, Institutional Area, Sector 32, Gurugram-122001, Haryana, India. This project comes under the pincode of 122017. The Westerlies spells convenience and comfort at a competitive price.Top Amenities in The WesterliesParkFlower GardensEvent Space & AmphitheatreMultipurpose HallClub HouseMeditation AreaVisitor ParkingThe Westerlies Floor PlanUnit ConfigurationUnit SizeThe Westerlies Residential Plot4059. 0 Sq. Ft. - 4482. 0 Sq. Ft.To gain an overview of the house structure, it is best to study the floor plans as these will give you a clear picture of the layout. The properties in The Westerlies have 1 types of configurations and are available in 2 layouts. Well spaced out balconies and bathrooms with latest fittings provide a truly liberating atmosphere. Magicbricks presents to you a range of layouts across different units of The Westerlies.The Westerlies BrochureYou can get all details of The Westerlies by downloading their PDF brochure here. The 'Download Brochure' link can be seen at the top right side of the page and can easily be downloaded from here. To download the brochure of The Westerlies you need to provide details of your name, number and email address.The Westerlies AddressThe The Westerlies is strategically located at Plot No. 18, 2nd Floor, Institutional Area, Sector 32, Gurugram-122001, Haryana, India, 122017.",Experion Developers Pvt Ltd19YearsExperience,"Sector 108,Gurgaon",{}
3 BHK Apartment for Sale in Sector 112 Gurgaon,3.80 Cr,2520 sqft,https://www.magicbricks.com/tata-gurgaon-gateway-sector-112-gurgaon-pdpid-4d4235303239353935,2,12,2025-08-11 12:26:14.208652,Updated 7 hours ago,2025-08-11 05:26:14.207742,3.0,3.0,3 BHK,Semi-Furnished,13 out of 23,,Tata Gurgaon Gateway,Ready to Move,,,,Resale,Main Road,94.7,[],True,,"About Tata Gurgaon GatewayTata Gurgaon Gateway located in Sector 112 , Gurgaon has amazing luxury flats available from Rs. 2.39 Cr - 5.24 Cr.Gurgaon Gateway sets a new benchmark for luxurious living and modern architecture, right from the plush double-heighted lobbies to the timber sun decks and private terraces that grace the apartments. A unique lifestyle awaits the patrons of this enclave, with sprawling balconies that overlook the lush greenery and landscapes. These balconies are seamless extensions of the living and dining areas. This means that residents can experience the outdoors from the comfort of their home. Every aspect of this expansive development has been designed with attention to the finest of details. For instance, the 3 bed residences have been innovatively designed to enable three open sides in the apartment to increase cross ventilation. So go ahead- live a life of grandeur, the one you were always meant to live.Tata Gurgaon Gateway StatusReady To MoveTowers in Tata Gurgaon Gateway6Positioned at well connected locality Sector 112, Tata Gurgaon Gateway is an aesthetically built project of Gurgaon. The property is a part of an integrated township which spreads over an area of 9 Acre. There are in total 358 units in this project.This world class Tata Gurgaon Gateway has been granted. its commencement certificate. The occupancy certificate also granted. A renowned builder TATA Housing Development Company Ltd. has crafted Tata Gurgaon Gateway with a lot of perfection. You can reach out to this project at Sector 112, Bajghera Road, Near Dwarka Expressway, Gurugram: 122017. 122017 is the area pincode under which this project falls. At Tata Gurgaon Gateway, a quality living is guaranteed by modern amenities and healthy surroundings.Top Amenities in Tata Gurgaon GatewayPower Back UpCafeteria/Food CourtJogging and Strolling TrackOutdoor Tennis CourtsAEROBICS ROOMEvent Space & AmphitheatreKids Play AreaTata Gurgaon Gateway BrochureWant to learn more about the well-planned Tata Gurgaon Gateway project? Download their detailed PDF brochure. You will find the brochure under the link 'Download Brochure', placed at the top right end of the page. You can have access to the brochure of Tata Gurgaon Gateway by providing details such as your name, email address and contact details.Tata Gurgaon Gateway AddressIf you would like to know the complete address for Tata Gurgaon Gateway in Gurgaon, it is Sector 112, Bajghera Road, Near Dwarka Expressway, Gurugram: 122017, 122017",TATA Housing Development Company Ltd.41YearsExperience,"Sector 112,Gurgaon",{}
