title,price,area,property_url,page_number,property_index,scraped_at,posting_date_text,parsed_posting_date,bathrooms,balcony,property_type,furnishing,floor_details,locality,society,status,facing,parking,ownership,transaction,overlooking,data_quality_score,validation_issues,is_valid,amenities,description,builder_name,location_address,specifications
3 BHK Apartment for Sale in Sector 36 Sohna Gurgaon,1.30 Cr,1081 sqft,https://www.magicbricks.com/signature-global-park-4-and-5-sohna-sector-36-gurgaon-pdpid-4d4235323036343435,3,25,2025-08-11 12:26:18.382605,Updated yesterday,2025-08-10 12:00:00.000000,2.0,3.0,3 BHK,Furnished,4 out of 4,,Signature Global Park 4 and 5,Ready to Move,West,,Freehold,Resale,"Garden/Park, Pool",105.3,[],True,,"About Signature Global Park 4 and 5Live in a rich home, in the lap of nature. Situated in the lower regions of the Aravallis, appreciate the green sections of land under a limitless blue sky - far away from the city's contamination. Here, top notch enhancements are served to you in a happily quiet air. Furthermore, the top notch floors are intended to guarantee sufficient regular daylight in every condo. Here living is a compelling artwork. Where the sky is bluer and the field is greener, washed in daylight, encircled by the fragrance of wet grass and, the music of flying creatures and humming bugs. It's an ideal mix of normal magnificence and solace that you call home.Signature Global Park 4 and 5 PriceRs. 1. 25 Cr - 1. 40 CrProject TypeResidentialProperty TypesBuilder FloorSignature Global Park 4 and 5 StatusReady To MoveSignature Global Park 4 and 5 Launch Date01 July 2020Signature Global Park 4 and 5 Possession Date01 July 2023Towers in Signature Global Park 4 and 5288Signature Global Park 4 and 5 is a well-planned project that is ideally positioned in Sector 36 Sohna, Gurgaon. This project has its expanse over an area of 26 Acre. A total of 867 are present in the project.Builder Floor are the various types of units available, each of which has been created to provide total satisfaction. This world class Signature Global Park 4 and 5 has been granted. its commencement certificate. The occupancy certificate of the project not granted, so you can be rest assured. Signature Global Park 4 and 5 is smartly developed by the well-known builder Signature Global. Strategically located, the complete address of this project is Sector 36, Sohna, Gurgaon. . The pincode for this project is 122102. Enjoy the luxury of living with all modern conveniences in Signature Global Park 4 and 5.Top Amenities in Signature Global Park 4 and 5FireplaceWaste DisposalDTH Television FacilityBanquet HallCafeteria/Food CourtConference RoomJogging and Strolling TrackSignature Global Park 4 and 5 Floor PlanUnit ConfigurationUnit SizeSignature Global Park 4 and 5 2 BHK Builder Floor1022. 0 Sq. Ft. - 1022. 0 Sq. Ft.Signature Global Park 4 and 5 3 BHK Builder Floor1120. 0 Sq. Ft. - 1120. 0 Sq. Ft.Floor plans tell you exactly how big or small the rooms or spaces in a house are, and so are the perfect way to get an understanding of the house layoutAt Signature Global Park 4 and 5 you can choose from 2 configurations that are available in 2 types of floor plans or layouts. These configurations come with well-fitted bathrooms and accessible balconies. The various types of floor plans of different units in Signature Global Park 4 and 5 can be viewed on MagicBricks.Signature Global Park 4 and 5 BrochureDownload the PDF brochure of Signature Global Park 4 and 5 and get the complete details of this beautifully constructed project. The brochure is accessible from the top right end of the page, under the link 'Download Brochure'To view the Signature Global Park 4 and 5 brochure PDF, fill in your details like name, contact number, and email ID.Signature Global Park 4 and 5 AddressWish to have a look and feel of the Signature Global Park 4 and 5 project? Reach out at Sector 36, Sohna, Gurgaon. , 122102.","Signature Global11YearsExperienceUnit No.101, Ground Floor, Tower-A,Signature Tower South City-1, Gurugram, Haryana 122 001, India","Sector 36 Sohna,Gurgaon",{}
"4 BHK Apartment for Sale in Behrampur Village, Sector 71, Sohna Road Gurgaon",1.35 Cr,2193 sqft,https://www.magicbricks.com/chd-avenue-71-behrampur-village-gurgaon-pdpid-4d4235303233303330,4,4,2025-08-11 12:26:22.198200,"Posted: Aug 05, '25",,3.0,,4 BHK,Semi-Furnished,,,CHD Avenue 71,Ready to Move,,,,Resale,,73.7,[],True,,"About CHD Avenue 71Well-placed in one of the of the sought-after residential pin code of Sector 71, Gurgaon - CHD Avenue 71 situated on Sohna Road is a prestigious development by CHD Developers Ltd.CHD Avenue 71 in Sector 71 , Gurgaon has apartments available at an affordable budget range between INR 72.0 Lac - 1.20 Cr..Spread across 16.5 acres of land, this project offers 2, 3 & 4 BHK apartments and penthouses that are beautifully designed.Project detailsThis residence looks stunning with 17 towers holding 862 well-crafted residential units. Bestowed with excellent reviews - CHD Avenue 71 placed in Sector 71, Gurgaon also gives an option of resale flats. The splendour of the beautiful themed gardens, parks, ponds, a luxurious swimming pool and a premium gazebo will certainly leave you enthralled. 3-tier security with CCTV monitoring assure a safe haven where your family stays sheltered.Also available for immediate rent, the well-ventilated residential apartments of CHD Avenue 71, Gurgaon are lauded for its skilful site & floor plan. The project is loaded with a pool of modern facilities like Wi-Fi connection, 24hours water & power supply, a well-equipped clubhouse with all the latest sport facilities and much more.HighpointsBordered by lush greenery and the eco-friendly measures like rainwater harvesting, water recycling, etc., have acknowledged this residence with Gold Certification by The Ministry of Environment & Forest.Bustling with lots of residential & commercial activities, Sohna Road is a dream destination for any home-seeker. The project provides good access to public transports, Medi City, Crowne Plaza, IFFCO Chowk and several other important places. Medanta-The Medicity, Indus World School and St. Xavier's High School are situated within close vicinity.Cash in and book a flat now in CHD Avenue 71 Sector 71, Gurgaon and live a blissful life with your family.Project TypeResidentialProperty TypesFlatCHD Avenue 71 StatusReady To MoveCHD Avenue 71 Launch Date01 May 2010CHD Avenue 71 Possession Date01 March 2014Towers in CHD Avenue 7117Favourably located in Sector 71 in Gurgaon, CHD Avenue 71 is a meticulously planned project. Spanning across 16 Acre, the project is well-spaced out. There are in total 862 units in this project.The project offers an array of property choices such as Flat to suit every individual's need. The grand CHD Avenue 71 project's commencement certificate has been granted. not granted is the status of the occupancy certificate of this project. The well-known builder CHD Developers Ltd. has developed CHD Avenue 71 project. You can reach out to this project at Sector 72, Gurugram, Haryana. The project falls under the pincode 122004. Enjoy the luxury of living with all modern conveniences in CHD Avenue 71.Top Amenities in CHD Avenue 71Mini Cinema TheatreFlower GardensEvent Space & AmphitheatreEarly Learning CentreDance StudioConcierge ServicesBank & ATMCHD Avenue 71 Floor PlanUnit ConfigurationUnit SizeCHD Avenue 71 2 BHK Flat1198. 0 Sq. Ft. - 1198. 0 Sq. Ft.CHD Avenue 71 3 BHK Flat1620. 0 Sq. Ft. - 1802. 0 Sq. Ft.CHD Avenue 71 4 BHK Flat2193. 0 Sq. Ft. - 2193. 0 Sq. Ft.The floor plan is a useful document that gives a realistic idea of the space covered, room sizes and the layout of the house. The properties in CHD Avenue 71 are available in 3 configurations and 4 varied layouts (or floor plans), The bathrooms are fixed with world-class fittings. Balconies are well-ventilated in all the configurations. You can view the different types of configurations of CHD Avenue 71 on Magicbricks.CHD Avenue 71 BrochureTo have a detailed look at the features of the marvelous CHD Avenue 71 project, download its all encompassing pdf. To download, navigate to the top right end of the page and hit the 'Download Brochure' link. All you need to do is provide your name, email ID and contact number, and you can download the brochure of CHD Avenue 71.CHD Avenue 71 AddressSector 72, Gurugram, Haryana, 122004, is the postal address of CHD Avenue 71 in Gurgaon.",CHD Developers Ltd.34YearsExperience,"Sector 71,Gurgaon",{}
4 BHK Apartment for Sale in Rail Vihar Sector 56 Gurgaon,66.4 Lac,1850 sqft,https://www.magicbricks.com/rail-vihar-rail-vihar-gurgaon-pdpid-4d4235313732313131,4,5,2025-08-11 12:26:22.199517,"Posted: Aug 05, '25",,3.0,,4 BHK,Semi-Furnished,,,Rail Vihar,Ready to Move,,,,Resale,,73.7,[],True,,"About Rail ViharRail Vihar StatusReady To MoveRail Vihar Possession Date01 January 2006Rail Vihar is conveniently situated in the Sector 56, Gurgaon and is a project that is well planned. This project encompasses over 445 units.The pin code of this masterpiece project is 122011. At Rail Vihar, you can enjoy a modern lifestyle as all conveniences are easily available.",,"Sector 56,Gurgaon",{}
"2 BHK Apartment for Sale in Tikri, Sector 48, Sohna Road Gurgaon",84.7 Lac,850 sqft,https://www.magicbricks.com/vipul-world-floors-tikri-gurgaon-pdpid-4d4235313639393431,4,8,2025-08-11 12:26:22.201667,"Posted: Aug 05, '25",,2.0,,2 BHK,Semi-Furnished,Carpet Area850 sqftStatusReady to MoveTransactionResaleFurnishingSemi-FurnishedSocietyVipul World FloorsBathroom2,,Vipul World Floors,Ready to Move,,,,Resale,,78.9,[],True,,"About Vipul World FloorsVipul World Floors StatusReady To MoveVipul World Floors Launch Date01 July 2006Vipul World Floors Possession Date01 August 2012Located in Sector 48, Gurgaon, the Vipul World Floors is a thoughtfully planned one, equipped with all amenities for a comfortable living. The entire project consists of over 768 residential units.The project falls under the pincode 122001. With all modern conveniences at your disposal, Vipul World Floors will ensure a quality living experience.",,"Sector 48,Gurgaon",{}
"3 BHK Apartment for Sale in Tikri, Sector 48, Sohna Road Gurgaon",2.82 Cr,3325 sqft,https://www.magicbricks.com/central-park-2-tikri-gurgaon-pdpid-4d4235303137343035,4,9,2025-08-11 12:26:22.202907,"Posted: Aug 05, '25",,3.0,,3 BHK,Furnished,,,Central Park 2,Ready to Move,,,,Resale,,73.7,[],True,,"About Central Park 2OverviewCentral Park 2 at Sector 48 , Gurgaon, offers high-end yet affordable apartment options ranging between Rs. 2.96 Cr - 14.07 Cr.Central Park 2 in Sector 48, Gurgaon, built by the reputed developer Central Park, is designed by one of the largest architectural firms Hellmuth, Obata and Kassabaum International. This elegantly designed project features a total of 16 towers housing around $unit residential apartments available for sale in the configuration of 1BHK, 2BHK, 3BHK and 4BHK units.About the ProjectCentral Park 2 offers a range of splendidly designed residential apartments ranging from 1BHK studio apartment to ultra-luxurious penthouses. Centrally situated, Central Park 2 enjoys excellent accessibility both from Hero Honda Chowk and Sohna Road. With 20 acres dedicated to developing a beautiful Central Garden, all the apartments enjoy fresh and are natural light all throughout the day. This fabulously designed residential project offers a variety of facilities including gym, clubhouse, kids play area, power backup, water supply, multipurpose court, swimming pool, video door security, shopping center, restaurant, cafeteria and ATM. The abundance of myriad leisure facilities will surely dissuade you from stepping out of your own little haven.HighpointsBeing a premium and luxurious residential development, Central Park 2 also enjoys the USP of a prime location as it is minutes away from Golf Course Extension Road and Huda City Center Metro Station. Rajiv Chowk and IFFCO Chowk are only 6.2km and 7.2km away. This project is ideally suited for families as all the basic facilities including schools, malls and hospitals such as G.D. Goenka Public School, Lotus Valley International School, Presidium School, Raheja Mall, Omaxe Gurgaon Mall, Park Hospital and Artemis Hospital can also be found in the vicinity. Invest now in Central Park 2 to enjoy all the fancy trimmings of an upscale and luxurious project.Project TypeResidentialProperty TypesFlatCentral Park 2 StatusReady To MoveCentral Park 2 Launch Date01 January 2012Central Park 2 Possession Date01 March 2016Towers in Central Park 216Located in Sector 48, Gurgaon, the Central Park 2 is a thoughtfully planned one, equipped with all amenities for a comfortable living. It is spread over a sprawling area of 47 Acre. There are total 1445 units in the project that are designed keeping the modern lifestyle in mind.The project boasts of a range of configurations viz Flat which are charming, yet durable. The beautiful Central Park 2's commencement certificate has been granted. In addition to this, the occupancy certificate granted. Central Park 2 has been built by reputed real estate developer Central Park. The exact address of this famous project is Sector 48, Gurugram, Haryana . The pin code of this project is 122001. Enjoy the comforts of living in Central Park 2 with all modern conveniences at your disposal.Top Amenities in Central Park 2Fire Fighting EquipmentGuest AccommodationFlower GardensEvent Space & AmphitheatreEarly Learning CentreDance StudioConcierge ServicesCentral Park 2 Floor PlanUnit ConfigurationUnit SizeCentral Park 2 1 BHK Flat1320. 0 Sq. Ft. - 1320. 0 Sq. Ft.Central Park 2 3 BHK Flat2350. 0 Sq. Ft. - 2550. 0 Sq. Ft.Floor plans tell you exactly how big or small the rooms or spaces in a house are, and so are the perfect way to get an understanding of the house layoutCentral Park 2 boasts of having 2 configurations available in 5 types of immaculately designed layouts. All these configurations come with bathrooms and balconies. You can view various layouts across different units sizes of Central Park 2 on Magicbricks.Central Park 2 AddressSector 48, Gurugram, Haryana , 122001, is the complete address of Central Park 2","Central Park27 Years ExperienceThe Median, Central Park Resorts,Sector-48, Gurugram, Haryana-122018","Sector 48, Gurgaon",{}
"3 BHK Apartment for Sale in Tikri, Sector 48, Sohna Road Gurgaon",2.37 Cr,2800 sqft,https://www.magicbricks.com/central-park-2-tikri-gurgaon-pdpid-4d4235303137343035,4,10,2025-08-11 12:26:22.204234,"Posted: Aug 05, '25",,3.0,,3 BHK,Unfurnished,,,Central Park 2,Ready to Move,,,,Resale,,73.7,[],True,,"About Central Park 2OverviewCentral Park 2 at Sector 48 , Gurgaon, offers high-end yet affordable apartment options ranging between Rs. 2.96 Cr - 14.07 Cr.Central Park 2 in Sector 48, Gurgaon, built by the reputed developer Central Park, is designed by one of the largest architectural firms Hellmuth, Obata and Kassabaum International. This elegantly designed project features a total of 16 towers housing around $unit residential apartments available for sale in the configuration of 1BHK, 2BHK, 3BHK and 4BHK units.About the ProjectCentral Park 2 offers a range of splendidly designed residential apartments ranging from 1BHK studio apartment to ultra-luxurious penthouses. Centrally situated, Central Park 2 enjoys excellent accessibility both from Hero Honda Chowk and Sohna Road. With 20 acres dedicated to developing a beautiful Central Garden, all the apartments enjoy fresh and are natural light all throughout the day. This fabulously designed residential project offers a variety of facilities including gym, clubhouse, kids play area, power backup, water supply, multipurpose court, swimming pool, video door security, shopping center, restaurant, cafeteria and ATM. The abundance of myriad leisure facilities will surely dissuade you from stepping out of your own little haven.HighpointsBeing a premium and luxurious residential development, Central Park 2 also enjoys the USP of a prime location as it is minutes away from Golf Course Extension Road and Huda City Center Metro Station. Rajiv Chowk and IFFCO Chowk are only 6.2km and 7.2km away. This project is ideally suited for families as all the basic facilities including schools, malls and hospitals such as G.D. Goenka Public School, Lotus Valley International School, Presidium School, Raheja Mall, Omaxe Gurgaon Mall, Park Hospital and Artemis Hospital can also be found in the vicinity. Invest now in Central Park 2 to enjoy all the fancy trimmings of an upscale and luxurious project.Project TypeResidentialProperty TypesFlatCentral Park 2 StatusReady To MoveCentral Park 2 Launch Date01 January 2012Central Park 2 Possession Date01 March 2016Towers in Central Park 216Located in Sector 48, Gurgaon, the Central Park 2 is a thoughtfully planned one, equipped with all amenities for a comfortable living. It is spread over a sprawling area of 47 Acre. There are total 1445 units in the project that are designed keeping the modern lifestyle in mind.The project boasts of a range of configurations viz Flat which are charming, yet durable. The beautiful Central Park 2's commencement certificate has been granted. In addition to this, the occupancy certificate granted. Central Park 2 has been built by reputed real estate developer Central Park. The exact address of this famous project is Sector 48, Gurugram, Haryana . The pin code of this project is 122001. Enjoy the comforts of living in Central Park 2 with all modern conveniences at your disposal.Top Amenities in Central Park 2Fire Fighting EquipmentGuest AccommodationFlower GardensEvent Space & AmphitheatreEarly Learning CentreDance StudioConcierge ServicesCentral Park 2 Floor PlanUnit ConfigurationUnit SizeCentral Park 2 1 BHK Flat1320. 0 Sq. Ft. - 1320. 0 Sq. Ft.Central Park 2 3 BHK Flat2350. 0 Sq. Ft. - 2550. 0 Sq. Ft.Floor plans tell you exactly how big or small the rooms or spaces in a house are, and so are the perfect way to get an understanding of the house layoutCentral Park 2 boasts of having 2 configurations available in 5 types of immaculately designed layouts. All these configurations come with bathrooms and balconies. You can view various layouts across different units sizes of Central Park 2 on Magicbricks.Central Park 2 AddressSector 48, Gurugram, Haryana , 122001, is the complete address of Central Park 2","Central Park27 Years ExperienceThe Median, Central Park Resorts,Sector-48, Gurugram, Haryana-122018","Sector 48, Gurgaon",{}
5 BHK Builder Floor for Sale in Surya Vihar Sector 21 Gurgaon,1.48 Cr,2500 sqft,https://www.magicbricks.com/mittal-surya-vihar-surya-vihar-sector-21-gurgaon-pdpid-4d4235303635383132,4,14,2025-08-11 12:26:22.207058,"Posted: Aug 05, '25",,5.0,,5 BHK,Furnished,Read more,,Mittal Surya Vihar,Ready to Move,,,,Resale,,78.9,[],True,,"About Mittal Surya ViharSavannah, a luxurious residential project by Bhandari Associates that has been meticulously designed and completed, is a popular choice among buyers searching for modern 1, 2 and 3 BHK ready-to-move apartments. Covering an expansive area of 12-acres, with a total of 495 vaastu compliant homes, this project is a gateway for peaceful, joyful and balanced lifestyle amid natural settings. Furthermore, Bhandari Savannah offers a slew of recreational amenities such as a jogging track, gymnasium, clubhouse, table tennis, children's play area, and a swimming pool. Other prime facilities include rainwater harvesting, sewage treatment plant, fire fighting system, garbage disposal, power backup, 24x7 security, and car parking. Wagholi is strategically positioned on the Pune-Nagar highway and enjoys easy access to the IT hubs of Kharadi. The industrial zones of Shikrapur, Mudhwa, Ranjangaon, Kalyani Nagar, and Koregaon Park are also easily accessible from here. In the vicinity, you have access to Moze College of Engineering, Sharad Pawar International School, Dhole Patil College of Engineering, Lexicon International School, Kolte Hospital, Phoenix Mall and Inorbit Mall.Mittal Surya Vihar StatusReady To MoveMittal Surya Vihar Possession Date01 December 2010Towers in Mittal Surya Vihar6Situated in Sector 21, the Mittal Surya Vihar is planned to offer a modern lifestyle to all the residents. Spread over 18 Acre, this project is impressive in its coverage. This project has a total of 500 units.The commencement certificate of the impressive Mittal Surya Vihar project has not been grantedThe occupancy certificate of this modern project not granted. Known for their quality constructions Micron Developers has developed Mittal Surya Vihar project. The site's complete address is Sector-21, Dundahera, Gurgaon, Haryana-122016. . Its pincode is 122016. Mittal Surya Vihar lets you enjoy a convenient lifestyle with all contemporary conveniences at your disposal.Top Amenities in Mittal Surya ViharPower Back UpLaundry ServiceDTH Television FacilityCanopy WalkFlower GardensIndoor Games RoomIndoor Squash & Badminton CourtsMittal Surya Vihar AddressThe exact address for Mittal Surya Vihar which is in Gurgaon is Sector-21, Dundahera, Gurgaon, Haryana-122016. , 122016.",Micron Developers,"Sector 21,Gurgaon",{}
"2 BHK Apartment for Sale in Chakkarpur, Sector 28 Gurgaon",32.3 Lac,100 sqyrd,https://www.magicbricks.com/maruti-vihar-colony-chakkarpur-gurgaon-pdpid-4d4235303736393331,4,21,2025-08-11 12:26:22.211347,"Posted: Aug 05, '25",,2.0,,2 BHK,Unfurnished,,,Maruti Vihar Colony,Ready to Move,,,,Resale,,73.7,[],True,,"About Maruti Vihar ColonyMaruti Vihar Colony located in Chakkarpur, Gurgaon is beautifully designed and developed by Residential Welfare Association. Maruti Vihar Colony comprises of 200 residential flats. All the residential flats are ready to move in. Navigate through Maruti Vihar Colony photos to see why this society is worth consideration.About the ProjectMaruti Vihar, Gurgaon is a colony built by the Residential Welfare Association. It is a popular residential project in Chakkarpur, Gurgaon. Presently, there are 200 elegantly crafted residences in Maruti Vihar. Moreover, the location of this Gurgaon colony is admirable. Maruti Vihar Colony floor plan is configured to include 1, 2 and 3 BHK residential apartments. Maruti Vihar Colony residential apartments are well designed and constructed with superior quality raw materials. Maruti Vihar Colony offers 1 and 2 BHK flats.Talking about 1 BHK flats, the rent is around 15,500. Similarly, the fully furnished 1 BHK residential flats have rent of 19,000 per month. The cost of fully furnished 1 BHK flats in Maruti Vihar are at a lower rate than other Gurgaon complexes. The price of 1 BHK flat with a built up area of 900 sqft area costs around 65 Lakhs.2 BHK flats in Maruti Vihar Colony cost the same as fully furnished 1 BHK’s. Whereas, the fully furnished flats have monthly rent of 20,000. The cost of 2 BHK flats in Maruti Vihar, Gurgaon is from 65 to 80 Lakhs.  Maruti Vihar Colony review is truly positive for new home seekers.This project provides many ultra modern amenities such as unique clubhouse, unique bar/lounge, security, park,  visitor parking,service/goods lift,  indoor games room, kids club, library and business centre, rentable community space, indoor squash and badminton courts, water storage, multipurpose courts, kids play pool with water slides and fire fighting equipment for a luxurious lifestyle.HighpointsSector 28 is close to many landmarks. Some of them include City Center Mall, Le Meridian Restaurant, PVR Sahara and Samudayik Kendra and Park.Maruti Vihar Colony StatusReady To MoveMaruti Vihar Colony Launch Date01 January 1995Maruti Vihar Colony Possession Date01 December 2000Situated in Chakkarpur, Sector 28, the Maruti Vihar Colony is planned to offer a modern lifestyle to all the residents. Spread over a vast area of 25 Acre, the project is a well-established one. The 200 in this project all come with smart interiors and well-utilised spaces.The commencement certificate of the impressive Maruti Vihar Colony project has not been grantedIn addition to this, the occupancy certificate not granted. Maruti Vihar Colony has been built by reputed real estate developer Cooperative Group Housing Society. Strategically located, the complete address of this project is Maruti Housing Colony, Sector 28, Gurugram, Haryana. The pin code of this masterpiece project is 122022. Enjoy the luxury of living with all modern conveniences in Maruti Vihar Colony.Top Amenities in Maruti Vihar ColonyClub HouseRentable Community SpaceMultipurpose CourtsLibrary And Business CentreKids Play Pool With Water SlidesKids ClubIndoor Squash & Badminton CourtsMaruti Vihar Colony AddressMaruti Housing Colony, Sector 28, Gurugram, Haryana, 122022, is the complete address of Maruti Vihar Colony",Cooperative Group Housing Society12 Years Experience,"Chakkarpur, Gurgaon",{}
