title,price,area,property_url,page_number,property_index,scraped_at,posting_date_text,parsed_posting_date
"2 BHK Apartment for Sale in Ravet, Pimpri Chinchwad Pune",₹89.8 Lac,821 sqft,https://www.magicbricks.com/aditya-vivaaz-ravet-pune-pdpid-4d4235303831343237,2,13,2025-08-10 18:04:51.929712,"15+ PhotosUpdated 13 hours ago Owner: nileshPremium Member2 BHK Apartment for Sale in Ravet, Pimpri Chinchwad PuneAditya VivaazCarpet Area821 sqftStatusReady to MoveFloor5 out of 14TransactionResaleFurnishingSemi-FurnishedfacingEastoverlookingGarden/Park, Pool, Main RoadSocietyAditya VivaazOwnershipFreeholdCar Parking1 CoveredBathroom2Balcony2East Facing PropertyNear S B Patil SchoolIts 2 BHK Flat For Sale.Key HighlightsGateway to Pune.Schools, Colleges, Hospitals, Banks are in the vicinity.Good investment potential.NearbyPCACS Ravet - Pimpri Chinchwad College of Arts, Commerce & Science BA/BCom College in Ravet, PCMC Aditi Multispeciality Hospital ₹89.8 Lac ₹8018 per sqft Contact Owner Get Phone No. ",2025-08-10 05:04:51.929686
3 BHK Apartment for Sale in Pashan Pune,₹1.75 Cr,1364 sqft,https://www.magicbricks.com/scn-orange-county-phase-i-pashan-pune-pdpid-4d4235323331303431,2,14,2025-08-10 18:04:51.930320,"20+ PhotosUpdated 13 hours ago Owner: Vijay KhairnarPremium Member3 BHK Apartment for Sale in Pashan PuneSCN Orange County Phase ICarpet Area1364 sqftStatusReady to MoveFloor1 out of 9TransactionResaleFurnishingSemi-FurnishedfacingEastoverlookingGarden/Park, Pool, Main RoadSocietySCN Orange County Phase IOwnershipCo-operative SocietyBathroom3Balcony4East Facing PropertyA spacious and beautiful 3 BHK with 4 balconies, at very prime location on Baner Pashan Link Road, Pune, this apartment is well-designed and provides a contemporary floor plan with welcoming interiors.Property SpecificationsWith no walls in common, open from all four sides and lots of sun and air throughout the year, this house is an ideal combination of privacy, comfort and good location. Divided over a carpet area of 1,364 sq ft, this semi-furnished flat is ideal if you prioritize space, sunlight and functioNearbyJanai super market Lokseva Eschool Lopmudra Hospital ₹1.75 Cr ₹9859 per sqft Contact Owner Get Phone No. ",2025-08-10 05:04:51.930299
2 BHK Apartment for Sale in Kaspate Wasti Pune,₹1.15 Cr,900 sqft,https://www.magicbricks.com/waghere-kalpataru-harmony-kaspate-vasti-pune-pdpid-4d4235303233353134,2,15,2025-08-10 18:04:51.930918,"14+ PhotosUpdated 13 hours ago Owner: JayPremium Member2 BHK Apartment for Sale in Kaspate Wasti PuneWaghere Kalpataru HarmonyCarpet Area900 sqftStatusReady to MoveFloor5 out of 12TransactionResaleFurnishingFurnishedfacingWestoverlookingGarden/ParkSocietyWaghere Kalpataru HarmonyOwnershipCo-operative SocietyCar Parking1 CoveredBathroom2Balcony2Kalpataru Harmony commands a premium over other societies in the neighbourhood because of larger flat size, Kalpataru brand name, premium construction quality, amenities, having roads on both the gates, cultural celebrations, home food availability, etc. The flat is facing the west direction. The Car parking is covered. The home has beautiful interiors consisting of a false ceiling and TV unit in the living room, convertible bed, bunk bed for kids, book shelf, many storages, 4 2 Sofa Set, Low seating dining Table, loft for drying clothes, Shoe Rack, Crompton Ozone 88 Cooler Glen Air Fryer.₹1.15 Cr ₹10000 per sqft Contact Owner Get Phone No. ",2025-08-10 05:04:51.930891
3 BHK Apartment for Sale in Songbirds Society Pune,₹1.40 Cr,1298 sqft,https://www.magicbricks.com/mont-vert-belair-songbirds-society-pune-pdpid-4d4235303033323433,2,16,2025-08-10 18:04:51.932108,"20+ PhotosUpdated 13 hours ago Owner: Rishikesh JoshiPremium Member3 BHK Apartment for Sale in Songbirds Society PuneMont Vert BelairCarpet Area1298 sqftStatusReady to MoveFloor6 out of 11TransactionResaleFurnishingFurnishedfacingEastoverlookingMain RoadSocietyMont Vert BelairOwnershipFreeholdBathroom3Balcony2East Facing PropertyProperty details A stunning three-bedroom flat is available for sale in the serene locality of Bhugaon, Pune. Thoughtfully designed to offer the perfect blend of comfort and convenience, this home is ideal for those seeking a luxurious and peaceful lifestyle. Surrounded by greenery and equipped with modern features, it provides a premium living experience in a well-connected yet tranquil environment.Property SpecificationsThis spacious flat boasts a generous carpet area of 1,298 sq.ft., featuring three large bedrooms, three modern bathrooms, and a dedicated parking space. The east-facing orientation ensures abundant natural light and excellent ventilation, creating a bright and airy atmosphere throughout the home. Fully furnished and ready to move in, the property offers both comfort and convenience, while still allowing room for personal touches to suit your style and preferences.FacilitiesResidents will enjoy a wide range of essential amenities, including 24-hour water supply, reliable power backup, advanced CCTV surveillance, a fully equipped gym, and access to an exclusive clubhouse. The building is secure, well-maintained, and thoughtfully designed to provide a safe, comfortable, and enriching living environment for all its occupants.LocalityBhugaon is a fast-emerging residential hub in Pune, known for its scenic beauty, tranquil surroundings, and proximity to nature. Located along the Paud Road and close to Kothrud and Bavdhan, it offers excellent connectivity to major parts of the city while maintaining a peaceful, green environment. With growing infrastructure, reputed schools, healthcare facilities, and recreational options nearby, Bhugaon is an ideal destination for homebuyers seeking a balanced lifestyle away from the citys hustle yet well-connected to urban conveniences.₹1.40 Cr ₹9346 per sqft Contact Owner Get Phone No. ",2025-08-10 05:04:51.932042
"2 BHK Apartment for Sale in Bopodi, Old Mumbai Pune-Highway Pune",₹77.9 Lac,929 sqft,https://www.magicbricks.com/kundan-kushal-nagar-bopodi-pune-pdpid-4d4235303033343434,2,17,2025-08-10 18:04:51.932734,"7+ PhotosUpdated 13 hours ago Owner: Deepesh DongrePremium Member2 BHK Apartment for Sale in Bopodi, Old Mumbai Pune-Highway PuneKundan Kushal NagarSuper Area929 sqftStatusReady to MoveFloor1 out of 6TransactionResaleFurnishingSemi-FurnishedfacingEastSocietyKundan Kushal NagarOwnershipFreeholdBathroom2Balcony1East Facing PropertyProperty SpecificationsA fantastic opportunity awaits with this beautifully designed 2 BHK flat for sale in Kundan Kushal Nagar, Bopodi, Pune. Located near Hosur Road, this ready-to-move -in property offers the perfect blend of comfort, convenience, and modern living. Spread across a well planned layout, the flat features 2 spacious bedrooms, 2 well-appointed bathrooms, and a balcony that provides ample natural light and ventilation. Priced at 77.9 lakh, this home is an excellent investment for end-users and investors alike, thanks to its prime location, thoughtful design, and easy access to key amenities and transport links.FacilitiesThis semi furnished 2 BHK flat in Kundan Kushal Nagar, Bopodi, Pune, offers a thoughtfully designed living space with a super built-up area of 929 sqft, ensuring ample room for a comfortable lifestyle. The layout includes a separate living area, a kitchen cum dining space, and is east-facing making it Vastu compliant and filled with natural light. The flat overlooks the main entry gate, adding to the sense of security and openness.Crafted for modern living, the property features vitrified flooring, one open four-wheeler parking, and one covered two-wheeler parking. It also provides reliable water supply with two time drinking water availability, water tanks, and a borewell system. Residents can enjoy a secure environment with 24 hours and 7 days CCTV surveillance and a dedicated security guard. The building is equipped with a lift and offers lifestyle amenities including a gym, clubhouse, and a well-maintained garden ensuring comfort, convenience, and community living at its best.LocalityThis well maintained flat is situated on the 1st floor of a 6 storey building, offering easy accessibility and convenience for everyday living. Located just behind Kirloskar Oil Engines, the property enjoys a peaceful and well developed neighborhood with a pleasant environment. The area boasts excellent connectivity and smooth commuting options, making it an ideal choice for both working professionals and families. With its strategic location and serene surroundings, this home strikes the perfect balance between comfort and accessibility.NearbyKhadki Railway Station Bus Stop Bopadi Metro Station ₹77.9 Lac ₹8382 per sqft Contact Owner Get Phone No. ",2025-08-10 05:04:51.932674
"2 BHK Apartment for Sale in Ideal Colony, Kothrud Pune",₹1.20 Cr,743 sqft,https://www.magicbricks.com/raigad-apartment-kothrud-ideal-colony-pune-pdpid-4d4235323430313639,2,18,2025-08-10 18:04:51.933299,"11+ PhotosUpdated 13 hours ago Owner: Prasann KulkarniPremium Member2 BHK Apartment for Sale in Ideal Colony, Kothrud PuneRaigad Apartment KothrudCarpet Area743 sqftStatusReady to MoveFloor2 out of 4TransactionResaleFurnishingSemi-FurnishedfacingNorthoverlookingMain RoadSocietyRaigad Apartment KothrudOwnershipFreeholdBathroom2The property is located near to Utsav Hall and close from Vanaz Metro station at walking distance of 5 minutes. can reach on 77760 20611 Strategically located in a prime area with all the basic facilities like schools Hospital Metro And bus services market and playground in the vicinity within 5 minutes. the building was planned to go for redevelopment but the members are waiting for enhanced offer over 60 and the discussions are in process. This 2 bhk property will turn in to 3 bhk with 2 car park in the near future. would be a ideal investment from the long term perspectiveNearbyGeetai Mall Swojas One P Jog College of Science and Commerce Ambedkar Hospital ₹1.20 Cr ₹13793 per sqft Contact Owner Get Phone No. ",2025-08-10 05:04:51.933273
3 BHK Apartment for Sale in Viman Nagar Pune,₹2.10 Cr,1006 sqft,https://www.magicbricks.com/rohan-mithila-viman-nagar-pune-pdpid-4d4235303030333638,2,20,2025-08-10 18:04:51.934598,"13+ PhotosUpdated 13 hours ago Owner: NeerajPremium Member3 BHK Apartment for Sale in Viman Nagar PuneRohan MithilaCarpet Area1006 sqftStatusReady to MoveFloor5 out of 6TransactionResaleFurnishingUnfurnishedfacingEastoverlookingGarden/Park, Main RoadSocietyRohan MithilaOwnershipFreeholdCar Parking1 OpenBathroom3Balcony1East Facing PropertyMake your dream home in this perfectly planned 3BHK flat for sale in ROHAN MITHILA at Viman Nagar Central, Pune. The flat offers the perfect blend of modern living, Club house, swimming Pool comfort, and smart location and serves as the perfect abode for families who desire to make the most out of one of the citys trendiest localities.Property SpecificationsLocated on the 5th floor of a 6storey complex, the flat has a carpet area of 1006 sq.ft., creating plenty of space and sunlight in every part of the house. The apartment consists of three bedrooms and three western toiletstwo attached and one shared. It has one big size Balcony, three geyser is installed for the convenience of hot water. There is a balcony opening to the living room, providing peaceful views of the garden and serving as a restful corner to sit and relax. The dining and living area is roomy and open to comfortable daily living and entertaining.The kitchen is modular, equipped with necessary cabinets and a piped gas supply connection, and has a utility area added for extra practicality. The interiors are topped with vitrified tile flooring, providing durability and maintenancefree living. This eastfacing residence is also Vaastu compliant, providing a positive and harmonious way of living. Available in an unfurnished state, the flat offers the opportunity to design and customize the interiors according to your liking and lifestyle. Situated in a desirable residential locality, this residence provides strategic location with practical design for urban living.FacilitiesThe apartment comes with basic amenities to provide a comfortable and secure lifestyle. It has covered parking for secure vehicle accommodation and 24hour water supply for continuous daily consumption. 100 power backup is available, providing constant power even during power failures. CCTV monitoring and a resident security guard ensure security in the building. Two elevators offer smooth and fast access to all levels, providing greater comfort and convenience.LocalityRohan Mithila Complex located close to Pune Airport, this Viman Nagar Central property has a very convenient and desirable location. The locality is welldeveloped with some of the best schools, hospitals, and malls or supermarkets within a distance of 1 km, thereby making life easy and convenient.There is readily available public transport with buses and autos operating throughout the day. Banks and ATMs are within easy reach for ease of money, and the rail station is just 4 to 5 km away, with excellent connectivity to the rest of the city and the world at large.Key HighlightsFor we know that mere space, a roof, and walls do not make a home, a family does. A stunning entrance and a grand lobby welcome you as you enter the premises. Celebrate the sunshine with our outdoor spaces or congregate in our community hall. NearbyEast Court Phoenix Market City Gupta Super Market Symbiosis School for Liberal Arts Air Force School Ramwadi Metro Station ₹2.10 Cr ₹15108 per sqft Contact Owner Get Phone No. ",2025-08-10 05:04:51.934538
3 BHK Apartment for Sale in Wakad Pune,₹1.30 Cr,1126 sqft,https://www.magicbricks.com/nisarg-srushti-wakad-pune-pdpid-4d4235303032383530,2,21,2025-08-10 18:04:51.935165,"19+ PhotosUpdated 13 hours ago Owner: Vikram UgalePremium Member3 BHK Apartment for Sale in Wakad PuneNisarg SrushtiCarpet Area1126 sqftStatusReady to MoveFloor1 out of 7TransactionResaleFurnishingUnfurnishedfacingEastoverlookingGarden/Park, Pool, Main RoadSocietyNisarg SrushtiOwnershipFreeholdBathroom3Balcony2East Facing PropertyNear Chatrapati Shivaji ChowkIts 3 BHK Flat For Sale.NearbyPhoenix Mall of the Millennium Jay Bhawani Super Market B G Academy (Pratham) Bal Seva English Medium School Kalewadi Phata Bus Stop Tendulkar Vasti Bus Stop ₹1.30 Cr ₹9630 per sqft Contact Owner Get Phone No. ",2025-08-10 05:04:51.935151
3 BHK Apartment for Sale in Wakad Pune,₹2.70 Cr,1576 sqft,https://www.magicbricks.com/golden-cascade-wakad-pune-pdpid-4d4235303336343035,2,22,2025-08-10 18:04:51.935737,"20+ PhotosUpdated 13 hours ago Owner: AshutoshMishraPremium Member3 BHK Apartment for Sale in Wakad PuneGolden CascadeCarpet Area1576 sqftStatusReady to MoveFloor2 out of 11TransactionResaleFurnishingFurnishedfacingEastoverlookingGarden/Park, Pool, Main RoadSocietyGolden CascadeOwnershipFreeholdBathroom3Balcony2East Facing PropertyNear Thopte English Medium SchoolIts 3 BHK Flat For Sale.NearbyPhoenix Mall of the Millennium Jay Bhawani Super Market Bal Seva English Medium School B G Academy (Pratham) Kalewadi Phata Bus Stop Tendulkar Vasti Bus Stop ₹2.70 Cr ₹14233 per sqft Contact Owner Get Phone No. ",2025-08-10 05:04:51.935722
3 BHK Apartment for Sale in Shankar Kalat Nagar Pune,₹1.26 Cr,1150 sqft,https://www.magicbricks.com/sonigara-omega-paradise-shankar-kalat-nagar-pune-pdpid-4d4235303030353836,2,23,2025-08-10 18:04:51.936307,"15+ PhotosUpdated 13 hours ago Owner: shraddhaPremium Member3 BHK Apartment for Sale in Shankar Kalat Nagar PuneSonigara Omega ParadiseCarpet Area1150 sqftStatusReady to MoveFloor4 out of 4TransactionResaleFurnishingFurnishedfacingWestoverlookingMain RoadSocietySonigara Omega ParadiseOwnershipFreeholdCar Parking1 OpenBathroom3Balcony3Explore Comfort and Luxury at Sonigara Omega Paradise, Shankar Kalat Nagar, PuneReady to move in, Sonigara Omega Paradise offers a remarkable 3 BHK furnished apartment that combines elegance, space, and functionality. Located in the well-established Shankar Kalat Nagar area of Pune, this property enjoys a prime location near the Phoenix Mall, offering easy access to shopping, dining, and entertainment options.Property SpecificationsSpread across a spacious 1450 sqft super area, with an impressive 1150 sqft carpet area, this apartment provides ample living space. Situated on the 8th floor of a well-maintained building, the unit offers stunning views of the main road, while its west-facing orientation ensures ample natural light and a pleasant ambiance throughout the day. The apartment is thoughtfully designed to maximize space with a separate dry balcony, perfect for storage or relaxation.The apartment comes fully furnished, featuring 3 bedrooms, 3 bathrooms, and a living-dining area that exudes comfort and style. The kitchen is equipped with modular fittings, including sinks, cabinets, and ample storage, making it functional and aesthetically pleasing. The vitrified flooring enhances the overall appeal, giving the home a clean, polished finish.Facilities and AmenitiesSonigara Omega Paradise offers a host of world-class amenities that cater to both relaxation and an active lifestyle. The property includes a swimming pool, a gym, table tennis, basketball courts, and a children's play area, perfect for families and individuals looking for a balanced lifestyle. For added convenience, 24-hour water supply and security ensure a comfortable and safe living environment. The building also features 1 open parking space for your convenience.LocalityStrategically located in Shankar Kalat Nagar, Pune, this apartment is in close proximity to the bustling Phoenix Mall, providing you with easy access to top retail outlets, restaurants, and entertainment hubs. The area is well-connected to major roads, making commuting a breeze. Additionally, schools, hospitals, and essential services are nearby, making it a highly desirable location for both families and professionals.With its convenient location, impressive facilities, and ready-to-move-in status, Sonigara Omega Paradise offers a perfect blend of luxury, comfort, and practicality for those looking to elevate their lifestyle in Pune.₹1.26 Cr ₹8720 per sqft Contact Owner Get Phone No. ",2025-08-10 05:04:51.936259
"1 BHK Apartment for Sale in Ravet, Pimpri Chinchwad Pune",₹52 Lac,433 sqft,https://www.magicbricks.com/gk-silverland-residency-phase-1-ravet-pune-pdpid-4d4235303938373433,2,24,2025-08-10 18:04:51.936937,"12+ PhotosUpdated 13 hours ago Owner: Nishant sharmaPremium Member1 BHK Apartment for Sale in Ravet, Pimpri Chinchwad PuneGK Silverland Residency Phase 1Carpet Area433 sqftStatusReady to MoveFloor5 out of 11TransactionResaleFurnishingFurnishedfacingEastoverlookingGarden/Park, Pool, Main RoadSocietyGK Silverland Residency Phase 1OwnershipCo-operative SocietyCar Parking1 Covered,Bathroom2Balcony1East Facing PropertyOpposite Sameer Lawns1 BHK Multistorey apartment is available for sale.Key HighlightsSpaces with ample natural light and ventilationAttractive Club HouseLargest township of the areaNearbyPCACS Ravet - Pimpri Chinchwad College of Arts, Commerce & Science BA/BCom College in Ravet, PCMC Aditi Multispeciality Hospital ₹52 Lac ₹9701 per sqft Contact Owner Get Phone No. ",2025-08-10 05:04:51.936918
2 BHK Apartment for Sale in Mundhwa Pune,₹75 Lac,643 sqft,https://www.magicbricks.com/amanora-victory-towers-mundhwa-pune-pdpid-4d4235313339343735,2,25,2025-08-10 18:04:51.937700,"13+ PhotosUpdated 13 hours ago Owner: Col Mohan KadamPremium Member2 BHK Apartment for Sale in Mundhwa PuneAmanora Victory TowersCarpet Area643 sqftStatusReady to MoveFloor9 out of 11TransactionResaleFurnishingUnfurnishedfacingNorthoverlookingGarden/Park, Main RoadSocietyAmanora Victory TowersOwnershipFreeholdCar Parking1 CoveredBathroom2Balcony1Step into your ideal home with this 2 BHK flat for sale in Amanora Victory Towers, Mundhwa, Pune. Vaastu compliant and north-facing, it invites positive energy and harmony. Enjoy the security and benefits of freehold ownership rights in a prestigious community. Experience modern living combined with thoughtful design in a prime locationProperty Specifications Set on the 9th floor of an 11-storey building, this spacious 2 BHK apartment with a carpet area of 643 sq.ft. offers a well-ventilated and functional living space ideal for urban comfort. The flat comes unfurnished, allowing you the freedom to design interiors to your taste. It features a bright living-cum-dining area, a standard kitchen equipped with a piped gas connection, and an attached utility space for added functionality. The apartment includes two bathroomsone attached and one commonboth designed in western style and fitted with geysers to ensure a continuous hot water supply. A single balcony opens from one of the bedrooms, offering a peaceful view of the society. The flooring throughout the apartment is finished with sleek vitrified tiles that enhance the overall aesthetic. Facilities The building offers two lifts for convenient access to all floors. Covered parking space is available for both bikes and cars. Residents also enjoy 24-hour water supply, 100 power backup, and round-the-clock security services. CCTV surveillance further adds to the safety and peace of mind, making this home a practical choice for those seeking both comfort and reliability.Locality Located near the prestigious Amanora Victory Towers, this locality offers excellent urban connectivity and daily convenience. Reputed schools and well-established hospitals are situated within a 1 km radius, ensuring access to quality education and healthcare. Shopping is hassle-free with malls and supermarkets also just 1 km away. Public transport is easily available, making daily commutes smooth and efficient. Banks and ATMs are close by, and the railway station is situated nearby, adding to the ease of intercity travel.Key HighlightsSchools in and around Amanora Sports Arena, 3 Operational schools within the TownshipSituated within 400 acres gated communityNearbyKohinoor Business Tower - Koregaon Park Annexe Aarya Mart The Orbis School ₹75 Lac ₹8824 per sqft Contact Owner Get Phone No. ",2025-08-10 05:04:51.937644
3 BHK Apartment for Sale in NIBM Road Pune,₹1.80 Cr,1196 sqft,https://www.magicbricks.com/lodha-bella-vita-nibm-road-pune-pdpid-4d4235323938383933,2,28,2025-08-10 18:04:51.940155,"15+ PhotosUpdated 13 hours ago Owner: Ajay NawaniPremium Member3 BHK Apartment for Sale in NIBM Road PuneLodha Bella VitaCarpet Area1196 sqftStatusReady to MoveFloor5 out of 27TransactionResaleFurnishingUnfurnishedfacingWestoverlookingGarden/ParkSocietyLodha Bella VitaOwnershipFreeholdCar Parking2 CoveredBathroom3Balcony1Nr Trebeca HIgh StreetEnter sophisticated and elite living with this luxurious 3.5 BHK apartment in Lodha Bella Vita, NIBM Roads most sought-after residential enclave. Conceived for contemporary families, this apartment for sale is crafted to give you just the right amount of comfort, space and sophistication.Property SpecificationsSituated in one of Punes most desirable addresses, this flat is a combination of the best in modern design and peaceful surroundings. Spanning a carpet area of 1196 sqft, this unfurnished flat is located on the 5th floor of a 27-storeyed building, providing east-west facing views and lots of natural light all day. The flat is Vaastu compliant, promoting peace and positivity for your family.The apartment has 3 bedrooms, and 3 bathroomstwo en suite and one sharedall with western-style fittings and geyser points. The novel aspect is the extra half-room that may be used as a home office, study, or pooja room, providing this apartment with additional flexibility. The floor plan has a spacious living cum dining area, a standard kitchen with piped gas connection, and a utility area adjacent for further convenience.One of the balconies is connected to the hall and another to the kitchen, with lovely green views, so your mornings and evenings are going to be peaceful and refreshing. The interiors feature a blend of marble and vitrified flooring, which adds to the looks as well as durability.FacilitiesThis apartment comes with 2 covered car parking spaces, 247 water supply, 100 power backup, and advanced security features including CCTV surveillance, manned security guards, and 3 high-speed lifts for convenience.LocalitySituated strategically in the vicinity of Trebeca High Street, D-Mart, and Inox, the project is in the proximity of prominent schools such as DPS, Bishops School, and Vibgyor. Top hospitals are just 12 km away with public transport, banks, and ATMs all nearby. The railway station is only 10 km away, and the closest metro station is 6 km, facilitating hassle-free daily commutes.Key HighlightsWell connected by public transportSurrounded by natural greeneryWide range of amenities₹1.80 Cr ₹11285 per sqft Contact Owner Get Phone No. ",2025-08-10 05:04:51.940047
2 BHK Apartment for Sale in Satav Nagar Pune,₹50 Lac,613 sqft,https://www.magicbricks.com/dreams-elina-satav-nagar-pune-pdpid-4d4235303232363737,2,29,2025-08-10 18:04:51.940884,16+ PhotosUpdated 13 hours ago Owner: Amandeep SinghPremium Member2 BHK Apartment for Sale in Satav Nagar PuneDreams ElinaCarpet Area613 sqftStatusReady to MoveFloor2 out of 10TransactionResaleFurnishingSemi-FurnishedfacingEastSocietyDreams ElinaOwnershipFreeholdCar Parking57 CoveredBathroom1Balcony1East Facing PropertyMultistorey apartment is available for sale. It is a good location property. Please contact for more details.Key HighlightsNext to JSPM and Lexicon International School3 from EON IT Park KharadiWell connected to the city₹50 Lac ₹7278 per sqft Contact Owner Get Phone No. ,2025-08-10 05:04:51.940860
