title,price,area,property_url,page_number,property_index,scraped_at,posting_date_text,parsed_posting_date
2 BHK Apartment for Sale in Mogappair West Ambattur Industrial Estate Chennai,₹99 Lac,960 sqft,https://www.magicbricks.com/vgn-minerva-mogappair-west-ambattur-industrial-estate-chennai-pdpid-4d4235303330323433,2,18,2025-08-10 18:05:29.510197,"13+ PhotosUpdated 13 hours ago Owner: Mehar SrinivasPremium Member2 BHK Apartment for Sale in Mogappair West Ambattur Industrial Estate ChennaiVGN MinervaCarpet Area960 sqftStatusReady to MoveFloor2 out of 4TransactionResaleFurnishingSemi-FurnishedfacingEastoverlookingGarden/Park, Main RoadOwnershipFreeholdCar Parking1 Covered,Bathroom2Balcony1East Facing PropertyNear by mgr university college.2 BHK Flat For Sale in VGN Minerva, Mogappair West, Ambattur Industrial Estate, Chennai. This is a well-maintained, vaastu-compliant flat with a north-east facing entrance, situated in a very prime and convenient locality.Property SpecificationsThis large 2 BHK flat, having a carpet area of 1162 sqft, is situated on the 2nd floor in a well-maintained building of 4 stories. The flat is semi-furnished and is offered with wardrobes, fans, lights, and 2 air conditioners for extra comfort.The flat has 2 bedrooms, one of which is a master bedroom with a western-style bathroom with geyser points attached, and another shared western bathroom. The living and dining rooms are incorporated into a cozy and spacious room, leading onto a balcony with views of the main road, providing good ventilation and pleasant views.The modular kitchen is sleek and functional and comes with a chimney and an in-built utility area. It also contains a piped gas connection to cook conveniently. The entire flat has flooring done with vitrified tiles, which enhances the sleek and neat look.FaciliteisResidents enjoy several first-rate amenities like parking under cover, 24-hour water supply, and 100 power back up for constant living. Safety is also well addressed with an exclusive guard and CCTV cameras fitted around the premises. The building has a lift for convenient access to all the floors.The locality provides ample facilities to improve your lifestyle, such as rainwater harvesting, clubhouse, swimming pool, gymnasium, parks, reserved parking, intercom facility, jogging and cycling tracks, flower gardens, kids play area, library and business centre, multipurpose courts, outdoor tennis courts, rentable community space, fire fighting equipment, and guest rooms.LocalitySituated in a decent location, this property is close to hospitals and schools, between 1 to 2 km, which is ideal for families. Supermarkets and malls are within walking distance for day-to-day convenience. Regular buses and auto-rickshaws are readily available for public transport. A planned metro station is 2 km from here and provides good connectivity with the rest of the city. Banks and ATMs are also easily accessible.NearbyVelammal Vedyalaya ₹99 Lac ₹8520 per sqft Contact Owner Get Phone No. ",2025-08-10 05:05:29.510140
4 BHK Apartment for Sale in Koyambedu Chennai,₹7 Cr,2982 sqft,https://www.magicbricks.com/crown-residences-koyambedu-chennai-pdpid-4d4235333933333233,2,22,2025-08-10 18:05:29.512503,"20+ PhotosUpdated 13 hours ago Owner: sriramPremium Member4 BHK Apartment for Sale in Koyambedu ChennaiCrown ResidencesCarpet Area2982 sqftStatusReady to MoveFloor11 out of 27TransactionResaleFurnishingUnfurnishedfacingEastoverlookingGarden/Park, PoolOwnershipFreeholdBathroom5Balcony2East Facing PropertyDiscover unparalleled luxury in the heart of Chennai with this exquisite 4 BHK flat for sale in Crown Residences, Koyambedu. Nestled on the 11th floor of a 27-floor tower, this signature flat offers a spacious carpet area of 3182 sqft and boasts a rare three-sided open view, filling the home with natural light and panoramic vistas.Property specifications and facilitiesSouth-facing and Vaastu-compliant, the residence features four elegant bedrooms and five western bathroomsfour attached to the bedrooms and one commonall equipped with geysers for year-round comfort. The separate living and dining areas open onto two balconies overlooking lush gardens, a serene park, and a sparkling pool, creating an inviting ambiance for relaxation and entertaining.A dedicated puja room adds a spiritual touch, while the open modular kitchen with piped gas connection and attached utility ensures culinary convenience. Additionally, a servant room with an attached western toilet offers practical support. The flat is adorned with vitrified flooring throughout, enhancing its sophisticated appeal.Two large covered stilt car parking spaces provide ample parking, while 24-hour water supply from both borewell and corporation sources, 100 power backup, vigilant security guards, and CCTV surveillance ensure a safe and comfortable lifestyle. Two lifts serve the building, complementing the premium living experience. Residents enjoy world-class amenities including a swimming pool, clubhouse, party hall, kids play area, squash court, gym, cricket pitch, tennis court, parks, and beautifully landscaped gardens.LocalityLocated in a prime city-center location, this home is close to reputed schools, hospitals, malls, supermarkets, banks, and ATMs. The Koyambedu metro station is within walking distance, and public transport is easily accessible, making commuting effortless.NearbyCollege of Music And Technology St. Thomas College of Arts And Science Appasamy Superspeciality Hospital Gmr Hospital Koyambedu Bus Stop Koyambedu Market Tambaram Bus Stop ₹7 Cr ₹21999 per sqft Contact Owner Get Phone No. ",2025-08-10 05:05:29.512460
2 BHK Apartment for Sale in Korattur Chennai,₹80 Lac,829 sqft,https://www.magicbricks.com/alliance-orchid-springs-korattur-chennai-pdpid-4d4235303236303132,2,27,2025-08-10 18:05:29.515782,"20+ PhotosUpdated 13 hours ago Owner: RameshBabu NelakantamPremium Member2 BHK Apartment for Sale in Korattur ChennaiAlliance Orchid SpringsCarpet Area829 sqftStatusReady to MoveFloor8 out of 12TransactionResaleFurnishingSemi-FurnishedfacingNorth - WestoverlookingMain RoadOwnershipFreeholdCar Parking1 Covered,Bathroom2Balcony1Tucked away in the peaceful yet well-connected neighbourhood of Korattur, this 2 BHK flat in Alliance Orchid Springs is where everyday convenience meets calm and open views. Thoughtfully designed, this flat on sale is a space youll want to come home to.Property SpecificationsSituated on the 8th floor of a 12-storey building, the flat enjoys nice natural ventilation and light, owing to its two-side open corner location. The apartment is semi-furnished with wardrobes, lights, and fans and thus is ready to move in but still gives room for you to put in your touch.Spreading over a super built-up area of 1029 sqft, the house has two spacious bedrooms, two western bathrooms one attached and one shared, and a modular kitchen with an attached utility area. The living and dining room leads out to a private balcony with serene views and a comfortable place to relax. The vitrified tile flooring in the house offers strength and a classy finish.FacilitiesThis residential society provides vital amenities and lifestyle amenities, such as 247 water supply, 100 power backup, two elevators, covered parking, round-the-clock security, and CCTV cameras. The apartment is planned with contemporary comforts in mind and encourages hassle-free city life.Residents of Alliance Orchid Springs also have access to a range of high-end amenities, such as a swimming pool, kids play zone, garden, fitness gym and clubhouse.LocalityClose to Anna Nagar, one of the major residential areas of Chennai, the project is well-laced with popular schools, hospitals such as DR Hospital, malls, supermarkets, and daily necessities. Public transportation is readily available, and the proximity to a metro station adds to the connectivity of major areas of the city.NearbyKalaimani Mall Vivekananda Kendra Zilla Parishad Vidyalaya Vivekananda Kendra Nagarpalika Vidyalaya Korattur Bus Terminus Bus Stop ₹80 Lac ₹7775 per sqft Contact Owner Get Phone No. ",2025-08-10 05:05:29.515731
2 BHK Apartment for Sale in Pammal Chennai,₹90 Lac,1237 sqft,https://www.magicbricks.com/appaswamy-the-bloomingdale-pammal-chennai-pdpid-4d4235303432303630,2,28,2025-08-10 18:05:29.516428,"11+ PhotosUpdated 13 hours ago Owner: SakethPremium Member2 BHK Apartment for Sale in Pammal ChennaiAppaswamy the BloomingdaleSuper Area1237 sqftStatusReady to MoveFloor11 out of 11TransactionResaleFurnishingFurnishedfacingSouthoverlookingGarden/Park, Main RoadOwnershipFreeholdBathroom2Balcony12 BHK Flat For Sale in Appaswamy The Bloomingdale, Pammal, Chennai. The south-facing, vaastu compliant house features the best combination of contemporary comfort and serene living in a well-connected residential area.Property SpecificationsSituated on the 11th floor in an 11-storey building, the flat provides a generous super built-up area of 1,237 sq.ft. and is vaastu compliant, facing south direction for better natural light and auspicious energy flow.The flat has two bedrooms with attached western-style toilets that have geysers for convenience. The living and dining room are a large, open area suitable for family occasions and hosting guests. There is a balcony off the hall with a view over the peaceful garden, giving a calming outlook and fresh air.The kitchen is modular with a chimney and comes with an adjacent utility area for added convenience. The floor all over the flat is finished with vitrified tiles to provide a clean and classy look.FacilitiesResidents have the benefit of covered parking, 24-hour supply of water, and 100% power backup for added convenience and comfort at all times. Security comes first with a separate security guard and CCTV surveillance provided all over the building. The building has two lifts for convenient access to all floors. The society provides various advanced amenities such as a children's play area, party hall, guest rooms, gym, swimming pool, and a clubhouse, which makes the society perfect for family life and social interactions.LocalityLocated near Shankara Eye Hospital, the area is well connected with basic necessities. Schools are within 3 to 4 km, while supermarkets are only 500 meters for daily convenience. Public transport is readily accessible, with the railway station being 6 km and the metro station merely 5 km from the premise. The Chennai airport is also within 5 km for easy traveling.Key HighlightsEasy access to daily needs.NearbyKhadim St. Theresa Girls Hr. Sec. School ₹90 Lac ₹7276 per sqft Contact Owner Get Phone No. ",2025-08-10 05:05:29.516368
2 BHK Apartment for Sale in Ayanambakkam Chennai,₹72 Lac,688 sqft,https://www.magicbricks.com/charan-enclave-ayanambakkam-chennai-pdpid-4d4235333234323937,2,30,2025-08-10 18:05:29.517686,"17+ PhotosUpdated 13 hours ago Owner: Ms Ramahamirtam karupaiahPremium Member2 BHK Apartment for Sale in Ayanambakkam ChennaiCharan EnclaveCarpet Area688 sqftStatusReady to MoveFloor2 out of 3TransactionNew PropertyFurnishingUnfurnishedfacingNorthoverlookingGarden/Park, Main RoadOwnershipFreeholdBathroom2Balcony1Near by velammal school.Newly Constructed PropertyNewly Constructed PropertyWelcome to your new house in Charan Enclave, Ayanambakkam, Chennai This 2 BHK flat for sale with a super area of 1017 sqft and carpet area of 688 sqft is ideal for families or individuals who require comfort and convenience. Located on the 2nd floor of a well-maintained building with 3 floors, this home is Vaastu compliant and north facing, ensuring a good and uplifting living condition.Property specifications and facilitiesThe apartment is unfurnished, leaving you free to create your own in your style. It has 2 bedrooms with 2 bathroomsone attached and one commonboth in western-style design with geyser points for convenience. The living cum dining space is large and welcoming, complemented by a balcony facing the opposite building. The kitchen comes with an attached utility area, providing that added functional touch for daily use.The flooring throughout is finished with vitrified tiles, imparting a stylish touch. Enjoy the convenience of covered parking, 24-hour water supply, 100 power backup for the common areas, 1 lift, a security guard and CCTV cameras for added safety.LocalityThis is a prime location in Ayanambakkam with proximity to numerous reputed schools such as Vellammal, Birla Mine, Aachi, Venkateswara, and New Century Matriculation within a 5 to 10 minute radius. Also, Apollo and SIMS hospitals are nearby. You will also have temples and hotels within close proximity. Shopping malls and supermarkets are within walking distance, and so are banks and ATMs. Public transportation facilities are easily accessible, and Ambattur railway station is a mere 2.5 km away, with good connectivity.Key HighlightsSmt Durga Devi Choudhry Vivekandha SchoolLa Chatelaine SchoolPon Vidyashram SchoolNearbyShree Sarasswathi Vidhyaah Mandheer New Century Matric Hr School Apollo Speciality Hospitals Vanagaram ₹72 Lac ₹7080 per sqft Contact Owner Get Phone No. ",2025-08-10 05:05:29.517649
